
Coronavirus Containment Act of 2020
Sponsor: Rep. Nadler, Jerrold [D-NY-10] (Introduced 07/16/2020) Cosponsors: (18)
Coronavirus Containment Act of 2020
2020-07-16 - Introduced in House
Committees: House - Judiciary
Introduced House

Jobs to Fight COVID-19 Act of 2020
Sponsor: Rep. Morelle, Joseph D. [D-NY-25] (Introduced 07/16/2020) Cosponsors: (2)
Jobs to Fight COVID-19 Act of 2020
2020-07-16 - Introduced in House
Committees: House - Education and Labor; Energy and Commerce
Introduced House

Taxpayer Fairness Fund Act of 2020
Sponsor: Rep. Moore, Gwen [D-WI-4] (Introduced 07/16/2020) Cosponsors: (0)
Taxpayer Fairness Fund Act of 2020
2020-07-16 - Introduced in House
Committees: House - Ways and Means
Introduced House

To provide for a COVID-19-related delay regarding annual limitation on cost-sharing for group health plans and individual and small group health insurance coverage.
Sponsor: Rep. McEachin, A. Donald [D-VA-4] (Introduced 07/16/2020) Cosponsors: (32)
To provide for a COVID-19-related delay regarding annual limitation on cost-sharing for group health plans and individual and small group health insurance coverage.
2020-07-16 - Introduced in House
Committees: House - Education and Labor; Energy and Commerce; Ways and Means
Introduced House

Protect America's Statues Act of 2020
Sponsor: Rep. McCarthy, Kevin [R-CA-23] (Introduced 07/16/2020) Cosponsors: (23)
Protect America's Statues Act of 2020
2020-07-16 - Introduced in House
Committees: House - Natural Resources; Transportation and Infrastructure
Introduced House

First Time Homebuyer Pandemic Savings Act
Sponsor: Rep. Maloney, Sean Patrick [D-NY-18] (Introduced 07/16/2020) Cosponsors: (2)
First Time Homebuyer Pandemic Savings Act
2020-07-16 - Introduced in House
Committees: House - Ways and Means
Introduced House

Juvenile Incarceration Reduction Act of 2020
Sponsor: Rep. Lewis, John [D-GA-5] (Introduced 07/16/2020) Cosponsors: (0)
Juvenile Incarceration Reduction Act of 2020
2020-07-16 - Introduced in House
Committees: House - Judiciary
Introduced House

To set forth the policy of the United States regarding vandalism, and for other purposes.
Sponsor: Rep. Lesko, Debbie [R-AZ-8] (Introduced 07/16/2020) Cosponsors: (20)
To set forth the policy of the United States regarding vandalism, and for other purposes.
2020-07-16 - Introduced in House
Committees: House - Armed Services; Oversight and Reform; Judiciary
Introduced House

Coronavirus Economic Relief for Transportation Services Act
Sponsor: Rep. LaHood, Darin [R-IL-18] (Introduced 07/16/2020) Cosponsors: (259)
Coronavirus Economic Relief for Transportation Services Act
2020-07-16 - Introduced in House
Committees: House - Appropriations; Budget
Introduced House

To amend the Internal Revenue Code of 1986 to apply the mailbox rule to certain payments made through the Electronic Federal Tax Payment System.
Sponsor: Rep. LaHood, Darin [R-IL-18] (Introduced 07/16/2020) Cosponsors: (1)
To amend the Internal Revenue Code of 1986 to apply the mailbox rule to certain payments made through the Electronic Federal Tax Payment System.
2020-07-16 - Introduced in House
Committees: House - Ways and Means
Introduced House

Local Journalism Sustainability Act
Sponsor: Rep. Kirkpatrick, Ann [D-AZ-2] (Introduced 07/16/2020) Cosponsors: (72)
Local Journalism Sustainability Act
2020-07-16 - Introduced in House
Committees: House - Ways and Means
Introduced House

To impose sanctions with respect to Turkey's acquisition of the S-400 air and missile defense system.
Sponsor: Rep. Kinzinger, Adam [R-IL-16] (Introduced 07/16/2020) Cosponsors: (2)
To impose sanctions with respect to Turkey's acquisition of the S-400 air and missile defense system.
2020-07-16 - Introduced in House
Committees: House - Financial Services; Foreign Affairs; Oversight and Reform; Judiciary; Ways and Means
Introduced House

Restoring Worker Power Act of 2020
Sponsor: Rep. Kennedy, Joseph P., III [D-MA-4] (Introduced 07/16/2020) Cosponsors: (11)
Restoring Worker Power Act of 2020
2020-07-16 - Introduced in House
Committees: House - Armed Services; Education and Labor; Oversight and Reform; House Administration; Energy and Commerce; Natural Resources; Judiciary; Veterans' Affairs
Introduced House

New White House Act
Sponsor: Rep. Jackson Lee, Sheila [D-TX-18] (Introduced 07/16/2020) Cosponsors: (0)
New White House Act
2020-07-16 - Introduced in House
Committees: House - Oversight and Reform
Introduced House

Custodial Interrogation Recording Act
Sponsor: Rep. Jackson Lee, Sheila [D-TX-18] (Introduced 07/16/2020) Cosponsors: (1)
Custodial Interrogation Recording Act
2020-07-16 - Introduced in House
Committees: House - Judiciary
Introduced House

To direct the Secretary of Labor to award grants to develop, administer, and evaluate early childhood education apprenticeships, and for other purposes.
Sponsor: Rep. Guthrie, Brett [R-KY-2] (Introduced 07/16/2020) Cosponsors: (1)
To direct the Secretary of Labor to award grants to develop, administer, and evaluate early childhood education apprenticeships, and for other purposes.
2020-07-16 - Introduced in House
Committees: House - Education and Labor
Introduced House

Isolate COVID-19 Act of 2020
Sponsor: Rep. Gonzalez, Anthony [R-OH-16] (Introduced 07/16/2020) Cosponsors: (6)
Isolate COVID-19 Act of 2020
2020-07-16 - Introduced in House
Committees: House - Energy and Commerce
Introduced House

Lead Abatement for Families Act of 2020
Sponsor: Rep. Garcia, Jesus G. "Chuy" [D-IL-4] (Introduced 07/16/2020) Cosponsors: (29)
Lead Abatement for Families Act of 2020
2020-07-16 - Introduced in House
Committees: House - Financial Services
Introduced House

Defund Cities that Defund the Police Act of 2020
Sponsor: Rep. Fitzpatrick, Brian K. [R-PA-1] (Introduced 07/16/2020) Cosponsors: (31)
Defund Cities that Defund the Police Act of 2020
2020-07-16 - Introduced in House
Committees: House - Financial Services; Transportation and Infrastructure
Introduced House

Coronavirus Relief Fund Local Government Flexibility Act
Sponsor: Rep. Fitzpatrick, Brian K. [R-PA-1] (Introduced 07/16/2020) Cosponsors: (6)
Coronavirus Relief Fund Local Government Flexibility Act
2020-07-16 - Introduced in House
Committees: House - Oversight and Reform
Introduced House

COACH Act
Sponsor: Rep. Finkenauer, Abby [D-IA-1] (Introduced 07/16/2020) Cosponsors: (17)
COACH Act
2020-07-16 - Introduced in House
Committees: House - Small Business
Introduced House

COVID-19 National Memorial Act
Sponsor: Rep. Espaillat, Adriano [D-NY-13] (Introduced 07/16/2020) Cosponsors: (1)
COVID-19 National Memorial Act
2020-07-16 - Introduced in House
Committees: House - Natural Resources
Introduced House

COVID-19 Victims Compensation Fund Act
Sponsor: Rep. Espaillat, Adriano [D-NY-13] (Introduced 07/16/2020) Cosponsors: (0)
COVID-19 Victims Compensation Fund Act
2020-07-16 - Introduced in House
Committees: House - Judiciary
Introduced House

MORE Savings Act
Sponsor: Rep. Dean, Madeleine [D-PA-4] (Introduced 07/16/2020) Cosponsors: (0)
MORE Savings Act
2020-07-16 - Introduced in House
Committees: House - Energy and Commerce; Ways and Means
Introduced House

Bonneville Shoreline Trail Advancement Act
Sponsor: Rep. Curtis, John R. [R-UT-3] (Introduced 07/16/2020) Cosponsors: (2)
Bonneville Shoreline Trail Advancement Act
2020-07-16 - Introduced in House
Committees: House - Natural Resources
Introduced House

Ryan Frascone Memorial Student Loan Relief Act of 2020
Sponsor: Rep. Craig, Angie [D-MN-2] (Introduced 07/16/2020) Cosponsors: (0)
Ryan Frascone Memorial Student Loan Relief Act of 2020
2020-07-16 - Introduced in House
Committees: House - Financial Services
Introduced House

To amend the Omnibus Crime Control and Safe Streets Act of 1968 to provide that COPS grant funds may be used for local law enforcement recruits to attend schools or academies if the recruits agree to serve in precincts of law enforcement agencies in their communities.
Sponsor: Rep. Correa, J. Luis [D-CA-46] (Introduced 07/16/2020) Cosponsors: (3)
To amend the Omnibus Crime Control and Safe Streets Act of 1968 to provide that COPS grant funds may be used for local law enforcement recruits to attend schools or academies if the recruits agree to serve in precincts of law enforcement agencies in their communities.
2020-07-16 - Introduced in House
Committees: House - Judiciary
Introduced House

Passport Backlog Elimination Act
Sponsor: Rep. Connolly, Gerald E. [D-VA-11] (Introduced 07/16/2020) Cosponsors: (11)
Passport Backlog Elimination Act
2020-07-16 - Introduced in House
Committees: House - Foreign Affairs
Introduced House

Share America's Diverse History in the Capitol Act
Sponsor: Rep. Cohen, Steve [D-TN-9] (Introduced 07/16/2020) Cosponsors: (1)
Share America's Diverse History in the Capitol Act
2020-07-16 - Introduced in House
Committees: House - House Administration
Introduced House

Comprehensive National Mercury Monitoring Act
Sponsor: Rep. Cartwright, Matt [D-PA-8] (Introduced 07/16/2020) Cosponsors: (3)
Comprehensive National Mercury Monitoring Act
2020-07-16 - Introduced in House
Committees: House - Energy and Commerce; Transportation and Infrastructure
Introduced House

Edith Shorougian Senior Victims of Fraud Compensation Act
Sponsor: Rep. Bonamici, Suzanne [D-OR-1] (Introduced 07/16/2020) Cosponsors: (10)
Edith Shorougian Senior Victims of Fraud Compensation Act
2020-07-16 - Introduced in House
Committees: House - Judiciary
Introduced House

Expanding Assistance to Farmers Act of 2020
Sponsor: Rep. Bishop, Dan [R-NC-9] (Introduced 07/16/2020) Cosponsors: (2)
Expanding Assistance to Farmers Act of 2020
2020-07-16 - Introduced in House
Committees: House - Small Business
Introduced House

COVID-19 Bias and Anti-Racism Training Act of 2020
Sponsor: Rep. Adams, Alma S. [D-NC-12] (Introduced 07/16/2020) Cosponsors: (17)
COVID-19 Bias and Anti-Racism Training Act of 2020
2020-07-16 - Introduced in House
Committees: House - Energy and Commerce
Introduced House

Defense, Commerce, Justice, Science, Energy and Water Development, Financial Services and General Government, Labor, Health and Human Services, Education, Transportation, Housing, and Urban Development Appropriations Act, 2021
Sponsor: Rep. Visclosky, Peter J. [D-IN-1] (Introduced 07/16/2020) Cosponsors: (0)
Defense, Commerce, Justice, Science, Energy and Water Development, Financial Services and General Government, Labor, Health and Human Services, Education, Transportation, Housing, and Urban Development Appropriations Act, 2021
2020-07-31 - Passed/agreed to in House: On passage Passed by the Yeas and Nays: 217 - 197 (Roll no. 178).
Committees: House - Appropriations | Senate - Appropriations
Passed House

Transportation, Housing and Urban Development, and Related Agencies Appropriations Act, 2021
Sponsor: Rep. Price, David E. [D-NC-4] (Introduced 07/16/2020) Cosponsors: (0)
Transportation, Housing and Urban Development, and Related Agencies Appropriations Act, 2021
2020-07-16 - The House Committee on Appropriations reported an original measure, H. Rept. 116-452, by Mr. Price (NC).
Committees: House - Appropriations
Introduced House

To provide a payroll tax credit for certain expenses associated with protecting employees from COVID-19.
Sponsor: Rep. Rice, Tom [R-SC-7] (Introduced 07/16/2020) Cosponsors: (16)
To provide a payroll tax credit for certain expenses associated with protecting employees from COVID-19.
2020-07-16 - Introduced in House
Committees: House - Ways and Means
Introduced House

Departments of Labor, Health and Human Services, and Education, and Related Agencies Appropriations Act, 2021
Sponsor: Rep. DeLauro, Rosa L. [D-CT-3] (Introduced 07/15/2020) Cosponsors: (0)
Departments of Labor, Health and Human Services, and Education, and Related Agencies Appropriations Act, 2021
2020-07-15 - The House Committee on Appropriations reported an original measure, H. Rept. 116-450, by Ms. DeLauro.
Committees: House - Appropriations
Introduced House

Energy and Water Development and Related Agencies Appropriations Act, 2021
Sponsor: Rep. Kaptur, Marcy [D-OH-9] (Introduced 07/15/2020) Cosponsors: (0)
Energy and Water Development and Related Agencies Appropriations Act, 2021
2020-07-15 - The House Committee on Appropriations reported an original measure, H. Rept. 116-449, by Ms. Kaptur.
Committees: House - Appropriations
Introduced House

Department of the Interior, Environment, and Related Agencies Appropriations Act, 2021
Sponsor: Rep. McCollum, Betty [D-MN-4] (Introduced 07/14/2020) Cosponsors: (0)
Department of the Interior, Environment, and Related Agencies Appropriations Act, 2021
2020-07-14 - The House Committee on Appropriations reported an original measure, H. Rept. 116-448, by Ms. McCollum.
Committees: House - Appropriations
Introduced House

Legislative Branch Appropriations Act, 2021
Sponsor: Rep. Ryan, Tim [D-OH-13] (Introduced 07/14/2020) Cosponsors: (0)
Legislative Branch Appropriations Act, 2021
2020-07-14 - The House Committee on Appropriations reported an original measure, H. Rept. 116-447, by Mr. Ryan.
Committees: House - Appropriations
Introduced House

Agriculture, Rural Development, Food and Drug Administration, and Related Agencies Appropriations Act, 2021
Sponsor: Rep. Bishop, Sanford D., Jr. [D-GA-2] (Introduced 07/13/2020) Cosponsors: (0)
Agriculture, Rural Development, Food and Drug Administration, and Related Agencies Appropriations Act, 2021
2020-07-13 - The House Committee on Appropriations reported an original measure, H. Rept. 116-446, by Mr. Bishop (GA).
Committees: House - Appropriations
Introduced House

Military Construction, Veterans Affairs, and Related Agencies Appropriations Act, 2021
Sponsor: Rep. Wasserman Schultz, Debbie [D-FL-23] (Introduced 07/13/2020) Cosponsors: (0)
Military Construction, Veterans Affairs, and Related Agencies Appropriations Act, 2021
2020-07-13 - The House Committee on Appropriations reported an original measure, H. Rept. 116-445, by Ms. Wasserman Schultz.
Committees: House - Appropriations
Introduced House

State, Foreign Operations, Agriculture, Rural Development, Interior, Environment, Military Construction, and Veterans Affairs Appropriations Act, 2021
Sponsor: Rep. Lowey, Nita M. [D-NY-17] (Introduced 07/13/2020) Cosponsors: (0)
State, Foreign Operations, Agriculture, Rural Development, Interior, Environment, Military Construction, and Veterans Affairs Appropriations Act, 2021
2020-07-24 - Passed/agreed to in House: On passage Passed by the Yeas and Nays: 224 - 189 (Roll no. 166).
Committees: House - Appropriations | Senate - Appropriations
Passed House

Masks for All Act of 2020
Sponsor: Rep. Wilson, Frederica S. [D-FL-24] (Introduced 07/13/2020) Cosponsors: (2)
Masks for All Act of 2020
2020-07-13 - Introduced in House
Committees: House - Energy and Commerce
Introduced House

MFAR Transparency Act
Sponsor: Rep. Williams, Roger [R-TX-25] (Introduced 07/13/2020) Cosponsors: (21)
MFAR Transparency Act
2020-07-13 - Introduced in House
Committees: House - Energy and Commerce
Introduced House

Coast Guard Combat-Injured Tax Fairness Act
Sponsor: Rep. Vela, Filemon [D-TX-34] (Introduced 07/13/2020) Cosponsors: (1)
Coast Guard Combat-Injured Tax Fairness Act
2020-07-13 - Introduced in House
Committees: House - Transportation and Infrastructure; Ways and Means
Introduced House

Democracy in Design Act
Sponsor: Rep. Titus, Dina [D-NV-1] (Introduced 07/13/2020) Cosponsors: (6)
Democracy in Design Act
2020-07-13 - Introduced in House
Committees: House - Transportation and Infrastructure
Introduced House

Improving Congressional Oversight of CFIUS Determinations Act
Sponsor: Rep. Taylor, Van [R-TX-3] (Introduced 07/13/2020) Cosponsors: (2)
Improving Congressional Oversight of CFIUS Determinations Act
2020-07-13 - Introduced in House
Committees: House - Financial Services; Foreign Affairs; Energy and Commerce
Introduced House

Fiscal Transparency Act of 2020
Sponsor: Rep. Steil, Bryan [R-WI-1] (Introduced 07/13/2020) Cosponsors: (5)
Fiscal Transparency Act of 2020
2020-07-13 - Introduced in House
Committees: House - Oversight and Reform
Introduced House

CONFUCIUS Act
Sponsor: Rep. Shalala, Donna E. [D-FL-27] (Introduced 07/13/2020) Cosponsors: (6)
CONFUCIUS Act
2020-07-13 - Introduced in House
Committees: House - Education and Labor
Introduced House

To expand the scope of the Department of Veterans Affairs open burn pit registry.
Sponsor: Rep. Ruiz, Raul [D-CA-36] (Introduced 07/13/2020) Cosponsors: (2)
To expand the scope of the Department of Veterans Affairs open burn pit registry.
2020-07-13 - Introduced in House
Committees: House - Veterans' Affairs
Introduced House

To direct the Secretary of Defense to provide budget information for incinerators and waste-to-energy waste disposal alternatives to burn pits.
Sponsor: Rep. Ruiz, Raul [D-CA-36] (Introduced 07/13/2020) Cosponsors: (2)
To direct the Secretary of Defense to provide budget information for incinerators and waste-to-energy waste disposal alternatives to burn pits.
2020-07-13 - Introduced in House
Committees: House - Armed Services
Introduced House

To direct the Secretary of Defense to include information on exposure to open burn pits in postdeployment health reassessments of members of the Armed Forces.
Sponsor: Rep. Ruiz, Raul [D-CA-36] (Introduced 07/13/2020) Cosponsors: (1)
To direct the Secretary of Defense to include information on exposure to open burn pits in postdeployment health reassessments of members of the Armed Forces.
2020-07-13 - Introduced in House
Committees: House - Armed Services
Introduced House

To direct the Secretary of Defense to submit to Congress a report on the research and studies being conducted or funded by the Department of Defense to assess the health effects of burn pits.
Sponsor: Rep. Ruiz, Raul [D-CA-36] (Introduced 07/13/2020) Cosponsors: (2)
To direct the Secretary of Defense to submit to Congress a report on the research and studies being conducted or funded by the Department of Defense to assess the health effects of burn pits.
2020-07-13 - Introduced in House
Committees: House - Armed Services
Introduced House

To direct the Secretary of Defense to provide medical providers of the Department of Defense mandatory training with respect to the potential health effects of burn pits.
Sponsor: Rep. Ruiz, Raul [D-CA-36] (Introduced 07/13/2020) Cosponsors: (2)
To direct the Secretary of Defense to provide medical providers of the Department of Defense mandatory training with respect to the potential health effects of burn pits.
2020-07-13 - Introduced in House
Committees: House - Armed Services
Introduced House

Drug-Free Communities Pandemic Relief Act
Sponsor: Rep. Rouda, Harley [D-CA-48] (Introduced 07/13/2020) Cosponsors: (55)
Drug-Free Communities Pandemic Relief Act
2020-07-13 - Introduced in House
Committees: House - Energy and Commerce
Introduced House

RAM Act of 2020
Sponsor: Rep. Posey, Bill [R-FL-8] (Introduced 07/13/2020) Cosponsors: (0)
RAM Act of 2020
2020-07-13 - Introduced in House
Committees: House - Ways and Means
Introduced House

TREATS Act
Sponsor: Rep. McKinley, David B. [R-WV-1] (Introduced 07/13/2020) Cosponsors: (5)
TREATS Act
2020-07-13 - Introduced in House
Committees: House - Energy and Commerce; Judiciary; Ways and Means
Introduced House

STIFLE Act of 2020
Sponsor: Rep. McAdams, Ben [D-UT-4] (Introduced 07/13/2020) Cosponsors: (1)
STIFLE Act of 2020
2020-09-21 - Passed/agreed to in House: On motion to suspend the rules and pass the bill Agreed to by voice vote.
Committees: House - Financial Services | Senate - Banking, Housing, and Urban Affairs
Passed House

Fostering Healthy Transitions into Adulthood Act of 2020
Sponsor: Rep. Lewis, John [D-GA-5] (Introduced 07/13/2020) Cosponsors: (0)
Fostering Healthy Transitions into Adulthood Act of 2020
2020-07-13 - Introduced in House
Committees: House - Education and Labor; Energy and Commerce; Judiciary; Ways and Means
Introduced House

To establish in the Cybersecurity and Infrastructure Security Agency of the Department of Homeland Security a pilot program for the purpose of carrying out a talent exchange program between the private sector and the Cybersecurity and Infrastructure Security Agency, and for other purposes.
Sponsor: Rep. Katko, John [R-NY-24] (Introduced 07/13/2020) Cosponsors: (2)
To establish in the Cybersecurity and Infrastructure Security Agency of the Department of Homeland Security a pilot program for the purpose of carrying out a talent exchange program between the private sector and the Cybersecurity and Infrastructure Security Agency, and for other purposes.
2020-07-13 - Introduced in House
Committees: House - Oversight and Reform; Homeland Security; Energy and Commerce
Introduced House

Cybersecurity and Infrastructure Security Agency Director and Assistant Directors Act
Sponsor: Rep. Katko, John [R-NY-24] (Introduced 07/13/2020) Cosponsors: (2)
Cybersecurity and Infrastructure Security Agency Director and Assistant Directors Act
2020-07-13 - Introduced in House
Committees: House - Oversight and Reform; Homeland Security; Energy and Commerce
Introduced House

Strengthening the Cybersecurity and Infrastructure Security Agency Act of 2020
Sponsor: Rep. Katko, John [R-NY-24] (Introduced 07/13/2020) Cosponsors: (2)
Strengthening the Cybersecurity and Infrastructure Security Agency Act of 2020
2020-07-13 - Introduced in House
Committees: House - Oversight and Reform; Homeland Security; Energy and Commerce; Transportation and Infrastructure
Introduced House

FLUENT Act
Sponsor: Rep. Grijalva, Raul M. [D-AZ-3] (Introduced 07/13/2020) Cosponsors: (11)
FLUENT Act
2020-07-13 - Introduced in House
Committees: House - Education and Labor
Introduced House

To temporarily extend participation in the 8(a) program of the Small Business Administration, and for other purposes.
Sponsor: Rep. Evans, Dwight [D-PA-3] (Introduced 07/13/2020) Cosponsors: (1)
To temporarily extend participation in the 8(a) program of the Small Business Administration, and for other purposes.
2020-07-13 - Introduced in House
Committees: House - Small Business
Introduced House

Rosie the Riveter National Historic Site Expansion Act
Sponsor: Rep. DeSaulnier, Mark [D-CA-11] (Introduced 07/13/2020) Cosponsors: (6)
Rosie the Riveter National Historic Site Expansion Act
2020-07-13 - Introduced in House
Committees: House - Natural Resources
Introduced House

To amend title 38, United States Code, to authorize individuals who are pursuing programs of rehabilitation, education, or training under laws administered by the Secretary of Veterans Affairs to receive work-study allowances for certain outreach services provided through congressional offices, and for other purposes.
Sponsor: Rep. DeFazio, Peter A. [D-OR-4] (Introduced 07/13/2020) Cosponsors: (3)
To amend title 38, United States Code, to authorize individuals who are pursuing programs of rehabilitation, education, or training under laws administered by the Secretary of Veterans Affairs to receive work-study allowances for certain outreach services provided through congressional offices, and for other purposes.
2020-07-13 - Introduced in House
Committees: House - Veterans' Affairs
Introduced House

Informing Consumers about Smart Devices Act
Sponsor: Rep. Curtis, John R. [R-UT-3] (Introduced 07/13/2020) Cosponsors: (2)
Informing Consumers about Smart Devices Act
2020-07-13 - Introduced in House
Committees: House - Energy and Commerce
Introduced House

To prohibit the President, the Vice President, an immediate family member of the President or the Vice President, and certain businesses from contracting with or receiving Federal funds, and for other purposes.
Sponsor: Rep. Cicilline, David N. [D-RI-1] (Introduced 07/13/2020) Cosponsors: (0)
To prohibit the President, the Vice President, an immediate family member of the President or the Vice President, and certain businesses from contracting with or receiving Federal funds, and for other purposes.
2020-07-13 - Introduced in House
Committees: House - Oversight and Reform
Introduced House

To require certain officers and employees in the executive branch of the Federal Government to divest certain financial interests, and for other purposes.
Sponsor: Rep. Cicilline, David N. [D-RI-1] (Introduced 07/13/2020) Cosponsors: (0)
To require certain officers and employees in the executive branch of the Federal Government to divest certain financial interests, and for other purposes.
2020-07-13 - Introduced in House
Committees: House - Oversight and Reform
Introduced House

White House Open Data Act
Sponsor: Rep. Cicilline, David N. [D-RI-1] (Introduced 07/13/2020) Cosponsors: (0)
White House Open Data Act
2020-07-13 - Introduced in House
Committees: House - Oversight and Reform
Introduced House

SAVE Jobs Act
Sponsor: Rep. Burgess, Michael C. [R-TX-26] (Introduced 07/13/2020) Cosponsors: (13)
SAVE Jobs Act
2020-07-13 - Introduced in House
Committees: House - Natural Resources; Ways and Means
Introduced House

Lieutenant Colonel Alexander Vindman Congressional Gold Medal Act
Sponsor: Rep. Boyle, Brendan F. [D-PA-2] (Introduced 07/13/2020) Cosponsors: (5)
Lieutenant Colonel Alexander Vindman Congressional Gold Medal Act
2020-07-13 - Introduced in House
Committees: House - Financial Services; Budget
Introduced House

Transition for Success Act
Sponsor: Rep. Axne, Cynthia [D-IA-3] (Introduced 07/13/2020) Cosponsors: (9)
Transition for Success Act
2020-07-13 - Introduced in House
Committees: House - Armed Services
Introduced House

Technical Correction to the Shoshone-Paiute Tribes of the Duck Valley Reservation Water Rights Settlement Act of 2020
Sponsor: Rep. Amodei, Mark E. [R-NV-2] (Introduced 07/13/2020) Cosponsors: (0)
Technical Correction to the Shoshone-Paiute Tribes of the Duck Valley Reservation Water Rights Settlement Act of 2020
2020-07-13 - Introduced in House
Committees: House - Natural Resources
Introduced House

Water Resources Development Act of 2020
Sponsor: Rep. DeFazio, Peter A. [D-OR-4] (Introduced 07/13/2020) Cosponsors: (3)
Water Resources Development Act of 2020
2020-07-29 - Passed/agreed to in House: On motion to suspend the rules and pass the bill, as amended Agreed to by voice vote.
Committees: House - Budget; Transportation and Infrastructure
Passed House

Strengthening America's Strategic National Stockpile Act of 2020
Sponsor: Rep. Slotkin, Elissa [D-MI-8] (Introduced 07/13/2020) Cosponsors: (20)
Strengthening America's Strategic National Stockpile Act of 2020
2020-09-21 - Passed/agreed to in House: On motion to suspend the rules and pass the bill, as amended Agreed to by voice vote.
Committees: House - Energy and Commerce | Senate - Health, Education, Labor, and Pensions
Passed House

To direct the Joint Committee on the Library to replace the bust of Roger Brooke Taney in the Old Supreme Court Chamber of the United States Capitol with a bust of Thurgood Marshall to be obtained by the Joint Committee on the Library and to remove certain statues from areas of the United States Capitol which are accessible to the public, to remove all statues of individuals who voluntarily served the Confederate States of America from display in the United States Capitol, and for other purposes.
Sponsor: Rep. Hoyer, Steny H. [D-MD-5] (Introduced 07/13/2020) Cosponsors: (16)
To direct the Joint Committee on the Library to replace the bust of Roger Brooke Taney in the Old Supreme Court Chamber of the United States Capitol with a bust of Thurgood Marshall to be obtained by the Joint Committee on the Library and to remove certain statues from areas of the United States Capitol which are accessible to the public, to remove all statues of individuals who voluntarily served the Confederate States of America from display in the United States Capitol, and for other purposes.
2020-07-22 - Passed/agreed to in House: On motion to suspend the rules and pass the bill, as amended Agreed to by the Yeas and Nays: (2/3 required): 305 - 113 (Roll no. 156).(text: CR H3658)
Committees: House - House Administration
Passed House

For the relief of Median El-Moustrah.
Sponsor: Rep. Tlaib, Rashida [D-MI-13] (Introduced 07/09/2020) (Private Legislation) Cosponsors: (0)
For the relief of Median El-Moustrah.
2020-07-09 - Introduced in House
Committees: House - Judiciary
Introduced House

Facilitating Reforms that Offer Necessary Telehealth In Every Rural (FRONTIER) Community Act
Sponsor: Rep. Young, Don [R-AK-At Large] (Introduced 07/09/2020) Cosponsors: (0)
Facilitating Reforms that Offer Necessary Telehealth In Every Rural (FRONTIER) Community Act
2020-07-09 - Introduced in House
Committees: House - Agriculture; Energy and Commerce; Ways and Means
Introduced House

To amend the Better Utilization of Investments Leading to Development Act of 2018 to facilitate increased equity investments under that Act.
Sponsor: Rep. Yoho, Ted S. [R-FL-3] (Introduced 07/09/2020) Cosponsors: (3)
To amend the Better Utilization of Investments Leading to Development Act of 2018 to facilitate increased equity investments under that Act.
2020-07-09 - Introduced in House
Committees: House - Foreign Affairs
Introduced House

Immigration Enforcement Moratorium Act
Sponsor: Rep. Wilson, Frederica S. [D-FL-24] (Introduced 07/09/2020) Cosponsors: (14)
Immigration Enforcement Moratorium Act
2020-07-09 - Introduced in House
Committees: House - Foreign Affairs; Judiciary
Introduced House

Public Safety Officer Support Act of 2020
Sponsor: Rep. Trone, David J. [D-MD-6] (Introduced 07/09/2020) Cosponsors: (1)
Public Safety Officer Support Act of 2020
2020-07-09 - Introduced in House
Committees: House - Judiciary
Introduced House

Helping Experts Accelerate Rare Treatments Act of 2020
Sponsor: Rep. Tonko, Paul [D-NY-20] (Introduced 07/09/2020) Cosponsors: (2)
Helping Experts Accelerate Rare Treatments Act of 2020
2020-07-09 - Introduced in House
Committees: House - Energy and Commerce
Introduced House

COVS Act
Sponsor: Rep. Spanberger, Abigail Davis [D-VA-7] (Introduced 07/09/2020) Cosponsors: (20)
COVS Act
2020-07-09 - Introduced in House
Committees: House - Oversight and Reform
Introduced House

To authorize the Seminole Tribe of Florida to lease or transfer certain land, and for other purposes.
Sponsor: Rep. Soto, Darren [D-FL-9] (Introduced 07/09/2020) Cosponsors: (7)
To authorize the Seminole Tribe of Florida to lease or transfer certain land, and for other purposes.
2020-07-09 - Introduced in House
Committees: House - Natural Resources
Introduced House

SEC Data Protection Act
Sponsor: Rep. Scott, David [D-GA-13] (Introduced 07/09/2020) Cosponsors: (17)
SEC Data Protection Act
2020-07-09 - Introduced in House
Committees: House - Financial Services
Introduced House

GI Internship Program Act
Sponsor: Rep. Schneider, Bradley Scott [D-IL-10] (Introduced 07/09/2020) Cosponsors: (14)
GI Internship Program Act
2020-07-09 - Introduced in House
Committees: House - Veterans' Affairs
Introduced House

COVID-19 Youth Sports and Healthy Working Families Relief Act
Sponsor: Rep. Rose, Max [D-NY-11] (Introduced 07/09/2020) Cosponsors: (37)
COVID-19 Youth Sports and Healthy Working Families Relief Act
2020-07-09 - Introduced in House
Committees: House - Small Business; Ways and Means
Introduced House

Stopping Malign Activities from Russian Terrorism Act
Sponsor: Rep. Rose, Max [D-NY-11] (Introduced 07/09/2020) Cosponsors: (3)
Stopping Malign Activities from Russian Terrorism Act
2020-07-09 - Introduced in House
Committees: House - Foreign Affairs; Judiciary
Introduced House

Guaranteeing Equipment Safety for Firefighters Act of 2020
Sponsor: Rep. Perlmutter, Ed [D-CO-7] (Introduced 07/09/2020) Cosponsors: (1)
Guaranteeing Equipment Safety for Firefighters Act of 2020
2020-07-09 - Introduced in House
Committees: House - Science, Space, and Technology
Introduced House

FUTURE of Artificial Intelligence Act of 2020
Sponsor: Rep. Olson, Pete [R-TX-22] (Introduced 07/09/2020) Cosponsors: (1)
FUTURE of Artificial Intelligence Act of 2020
2020-07-09 - Introduced in House
Committees: House - Science, Space, and Technology
Introduced House

FADS Act
Sponsor: Rep. Olson, Pete [R-TX-22] (Introduced 07/09/2020) Cosponsors: (5)
FADS Act
2020-07-09 - Introduced in House
Committees: House - Foreign Affairs
Introduced House

To amend title VI of the Social Security Act to extend the coverage of Coronavirus Relief Fund payments to Tribal Governments.
Sponsor: Rep. O'Halleran, Tom [D-AZ-1] (Introduced 07/09/2020) Cosponsors: (14)
To amend title VI of the Social Security Act to extend the coverage of Coronavirus Relief Fund payments to Tribal Governments.
2020-07-09 - Introduced in House
Committees: House - Oversight and Reform
Introduced House

To amend the Internal Revenue Code of 1986 to make a portion of research credit refundable for certain small businesses engaging in specified medical research.
Sponsor: Rep. Nunes, Devin [R-CA-22] (Introduced 07/09/2020) Cosponsors: (0)
To amend the Internal Revenue Code of 1986 to make a portion of research credit refundable for certain small businesses engaging in specified medical research.
2020-07-09 - Introduced in House
Committees: House - Ways and Means
Introduced House

To amend the Internal Revenue Code of 1986 to add a new medical research component to the credit for increasing research activities.
Sponsor: Rep. Nunes, Devin [R-CA-22] (Introduced 07/09/2020) Cosponsors: (0)
To amend the Internal Revenue Code of 1986 to add a new medical research component to the credit for increasing research activities.
2020-07-09 - Introduced in House
Committees: House - Ways and Means
Introduced House

American Farmers, Food Banks, and Families Act of 2020
Sponsor: Rep. Newhouse, Dan [R-WA-4] (Introduced 07/09/2020) Cosponsors: (2)
American Farmers, Food Banks, and Families Act of 2020
2020-07-09 - Introduced in House
Committees: House - Agriculture
Introduced House

DEFEND Act
Sponsor: Rep. Murphy, Stephanie N. [D-FL-7] (Introduced 07/09/2020) Cosponsors: (5)
DEFEND Act
2020-07-09 - Introduced in House
Committees: House - Intelligence (Permanent Select)
Introduced House

PREPARE Act
Sponsor: Rep. Morelle, Joseph D. [D-NY-25] (Introduced 07/09/2020) Cosponsors: (11)
PREPARE Act
2020-07-09 - Introduced in House
Committees: House - Small Business
Introduced House

Earned Income and Child Tax Credits Outreach Act of 2020
Sponsor: Rep. Moore, Gwen [D-WI-4] (Introduced 07/09/2020) Cosponsors: (38)
Earned Income and Child Tax Credits Outreach Act of 2020
2020-07-09 - Introduced in House
Committees: House - Ways and Means
Introduced House

Confederate Commemorative Works Inventory and Joint Resource Study Act
Sponsor: Rep. McEachin, A. Donald [D-VA-4] (Introduced 07/09/2020) Cosponsors: (3)
Confederate Commemorative Works Inventory and Joint Resource Study Act
2020-07-09 - Introduced in House
Committees: House - Armed Services; Natural Resources; Veterans' Affairs
Introduced House

Foreign Trade Modernization Act of 2020
Sponsor: Rep. McCaul, Michael T. [R-TX-10] (Introduced 07/09/2020) Cosponsors: (1)
Foreign Trade Modernization Act of 2020
2020-07-09 - Introduced in House
Committees: House - Foreign Affairs
Introduced House

Made in America: Preparation for a Pandemic Act of 2020
Sponsor: Rep. Maloney, Carolyn B. [D-NY-12] (Introduced 07/09/2020) Cosponsors: (1)
Made in America: Preparation for a Pandemic Act of 2020
2020-07-09 - Introduced in House
Committees: House - Oversight and Reform; Ways and Means
Introduced House

LEAD Act of 2020
Sponsor: Rep. Lieu, Ted [D-CA-33] (Introduced 07/09/2020) Cosponsors: (0)
LEAD Act of 2020
2020-07-09 - Introduced in House
Committees: House - Natural Resources
Introduced House

Minority Community Public Health Emergency Response Act of 2020
Sponsor: Rep. Lewis, John [D-GA-5] (Introduced 07/09/2020) Cosponsors: (0)
Minority Community Public Health Emergency Response Act of 2020
2020-07-09 - Introduced in House
Committees: House - Energy and Commerce; Ways and Means
Introduced House

Transportation and Infrastructure Profession Opportunity Grants Act
Sponsor: Rep. Lewis, John [D-GA-5] (Introduced 07/09/2020) Cosponsors: (0)
Transportation and Infrastructure Profession Opportunity Grants Act
2020-07-09 - Introduced in House
Committees: House - Ways and Means
Introduced House

Missed Opportunities in Public Health and Biomedical Research Act of 2020
Sponsor: Rep. Lewis, John [D-GA-5] (Introduced 07/09/2020) Cosponsors: (3)
Missed Opportunities in Public Health and Biomedical Research Act of 2020
2020-07-09 - Introduced in House
Committees: House - Energy and Commerce
Introduced House

HELP Act of 2020
Sponsor: Rep. Lewis, John [D-GA-5] (Introduced 07/09/2020) Cosponsors: (4)
HELP Act of 2020
2020-07-09 - Introduced in House
Committees: House - Energy and Commerce
Introduced House

To amend title 10, United States Code, to identify additional factors for the design of the counseling pathways of the Transition Assistance Program.
Sponsor: Rep. Levin, Mike [D-CA-49] (Introduced 07/09/2020) Cosponsors: (0)
To amend title 10, United States Code, to identify additional factors for the design of the counseling pathways of the Transition Assistance Program.
2020-07-09 - Introduced in House
Committees: House - Armed Services
Introduced House

VA Zero Suicide Demonstration Project Act of 2020
Sponsor: Rep. Lee, Susie [D-NV-3] (Introduced 07/09/2020) Cosponsors: (7)
VA Zero Suicide Demonstration Project Act of 2020
2020-07-09 - Introduced in House
Committees: House - Veterans' Affairs
Introduced House

PLANT Act of 2020
Sponsor: Rep. LaMalfa, Doug [R-CA-1] (Introduced 07/09/2020) Cosponsors: (5)
PLANT Act of 2020
2020-07-09 - Introduced in House
Committees: House - Agriculture; Energy and Commerce; Natural Resources; Judiciary
Introduced House

Strengthening Behavioral Health Parity Act
Sponsor: Rep. Kennedy, Joseph P., III [D-MA-4] (Introduced 07/09/2020) Cosponsors: (6)
Strengthening Behavioral Health Parity Act
2020-07-09 - Introduced in House
Committees: House - Education and Labor; Energy and Commerce; Ways and Means
Introduced House

Essential Workforce Parity Act
Sponsor: Rep. Kelly, Mike [R-PA-16] (Introduced 07/09/2020) Cosponsors: (1)
Essential Workforce Parity Act
2020-07-09 - Introduced in House
Committees: House - Education and Labor; Oversight and Reform; House Administration; Judiciary
Introduced House

Infectious Disease Therapies Research and Innovation Act of 2020
Sponsor: Rep. Kelly, Mike [R-PA-16] (Introduced 07/09/2020) Cosponsors: (0)
Infectious Disease Therapies Research and Innovation Act of 2020
2020-07-09 - Introduced in House
Committees: House - Ways and Means
Introduced House

State Attorneys General Empowerment Act of 2020
Sponsor: Rep. Kelly, Robin L. [D-IL-2] (Introduced 07/09/2020) Cosponsors: (6)
State Attorneys General Empowerment Act of 2020
2020-07-09 - Introduced in House
Committees: House - Judiciary
Introduced House

Expanding SNAP Options Act of 2020
Sponsor: Rep. Kelly, Robin L. [D-IL-2] (Introduced 07/09/2020) Cosponsors: (9)
Expanding SNAP Options Act of 2020
2020-07-09 - Introduced in House
Committees: House - Agriculture
Introduced House

RURAL HELP Act of 2020
Sponsor: Rep. Keller, Fred [R-PA-12] (Introduced 07/09/2020) Cosponsors: (7)
RURAL HELP Act of 2020
2020-07-09 - Introduced in House
Committees: House - Ways and Means
Introduced House

Small Business Category Management Training Act
Sponsor: Rep. Joyce, John [R-PA-13] (Introduced 07/09/2020) Cosponsors: (0)
Small Business Category Management Training Act
2020-07-09 - Introduced in House
Committees: House - Small Business
Introduced House

Effective Death Penalty Appeals Act
Sponsor: Rep. Johnson, Henry C. "Hank," Jr. [D-GA-4] (Introduced 07/09/2020) Cosponsors: (27)
Effective Death Penalty Appeals Act
2020-07-09 - Introduced in House
Committees: House - Judiciary
Introduced House

Infectious Disease Epidemic and Pandemic Preparedness Act
Sponsor: Rep. Higgins, Brian [D-NY-26] (Introduced 07/09/2020) Cosponsors: (1)
Infectious Disease Epidemic and Pandemic Preparedness Act
2020-07-09 - Introduced in House
Committees: House - Energy and Commerce
Introduced House

Protecting Students from Cybercrimes Act
Sponsor: Rep. Harder, Josh [D-CA-10] (Introduced 07/09/2020) Cosponsors: (0)
Protecting Students from Cybercrimes Act
2020-07-09 - Introduced in House
Committees: House - Education and Labor; Judiciary
Introduced House

21st Century SCRA Act
Sponsor: Rep. Haaland, Debra A. [D-NM-1] (Introduced 07/09/2020) Cosponsors: (9)
21st Century SCRA Act
2020-07-09 - Introduced in House
Committees: House - Veterans' Affairs
Introduced House

Get America Back to Work Act
Sponsor: Rep. Graves, Garret [R-LA-6] (Introduced 07/09/2020) Cosponsors: (7)
Get America Back to Work Act
2020-07-09 - Introduced in House
Committees: House - Education and Labor; Judiciary
Introduced House

MMEDS Act of 2020
Sponsor: Rep. Gonzalez-Colon, Jenniffer [R-PR-At Large] (Introduced 07/09/2020) Cosponsors: (9)
MMEDS Act of 2020
2020-07-09 - Introduced in House
Committees: House - Energy and Commerce; Ways and Means
Introduced House

Stop Foreign Payoffs Act
Sponsor: Rep. Golden, Jared F. [D-ME-2] (Introduced 07/09/2020) Cosponsors: (0)
Stop Foreign Payoffs Act
2020-07-09 - Introduced in House
Committees: House - Oversight and Reform; House Administration
Introduced House

Crack Down on Dark Money Act
Sponsor: Rep. Golden, Jared F. [D-ME-2] (Introduced 07/09/2020) Cosponsors: (7)
Crack Down on Dark Money Act
2020-07-09 - Introduced in House
Committees: House - Ways and Means
Introduced House

Wear Your Mask Act
Sponsor: Rep. Garcia, Sylvia R. [D-TX-29] (Introduced 07/09/2020) Cosponsors: (31)
Wear Your Mask Act
2020-07-09 - Introduced in House
Committees: House - House Administration; Transportation and Infrastructure
Introduced House

TIFIA for Airports Act
Sponsor: Rep. Garamendi, John [D-CA-3] (Introduced 07/09/2020) Cosponsors: (3)
TIFIA for Airports Act
2020-07-09 - Introduced in House
Committees: House - Transportation and Infrastructure
Introduced House

To establish the Small Business Economic Assistance Program.
Sponsor: Rep. Gallego, Ruben [D-AZ-7] (Introduced 07/09/2020) Cosponsors: (0)
To establish the Small Business Economic Assistance Program.
2020-07-09 - Introduced in House
Committees: House - Small Business
Introduced House

Safe Line Speeds in COVID-19 Act
Sponsor: Rep. Fudge, Marcia L. [D-OH-11] (Introduced 07/09/2020) Cosponsors: (33)
Safe Line Speeds in COVID-19 Act
2020-07-09 - Introduced in House
Committees: House - Agriculture; Education and Labor; Energy and Commerce
Introduced House

National Broadband Plan for the Future Act of 2020
Sponsor: Rep. Eshoo, Anna G. [D-CA-18] (Introduced 07/09/2020) Cosponsors: (6)
National Broadband Plan for the Future Act of 2020
2020-07-09 - Introduced in House
Committees: House - Energy and Commerce
Introduced House

Rewards for Providing Information on Foreign Election Interference Act
Sponsor: Rep. Engel, Eliot L. [D-NY-16] (Introduced 07/09/2020) Cosponsors: (2)
Rewards for Providing Information on Foreign Election Interference Act
2020-07-09 - Introduced in House
Committees: House - Foreign Affairs
Introduced House

Safer Compounding in Hospitals Act of 2020
Sponsor: Rep. Doyle, Michael F. [D-PA-18] (Introduced 07/09/2020) Cosponsors: (1)
Safer Compounding in Hospitals Act of 2020
2020-07-09 - Introduced in House
Committees: House - Ways and Means
Introduced House

Protect Access to Birth Control Act
Sponsor: Rep. DeGette, Diana [D-CO-1] (Introduced 07/09/2020) Cosponsors: (142)
Protect Access to Birth Control Act
2020-07-09 - Introduced in House
Committees: House - Education and Labor; Energy and Commerce; Ways and Means
Introduced House

Clean Energy Innovation and Deployment Act of 2020
Sponsor: Rep. DeGette, Diana [D-CO-1] (Introduced 07/09/2020) Cosponsors: (2)
Clean Energy Innovation and Deployment Act of 2020
2020-07-09 - Introduced in House
Committees: House - Education and Labor; Energy and Commerce; Transportation and Infrastructure; Science, Space, and Technology; Ways and Means
Introduced House

Maritime Transportation System Emergency Relief Act of 2020
Sponsor: Rep. DeFazio, Peter A. [D-OR-4] (Introduced 07/09/2020) Cosponsors: (16)
Maritime Transportation System Emergency Relief Act of 2020
2020-07-09 - Introduced in House
Committees: House - Transportation and Infrastructure
Introduced House

Gabby's Law Act
Sponsor: Rep. Davis, Rodney [R-IL-13] (Introduced 07/09/2020) Cosponsors: (0)
Gabby's Law Act
2020-07-09 - Introduced in House
Committees: House - Energy and Commerce; Ways and Means
Introduced House

Capitol Police Advancement Act of 2020
Sponsor: Rep. Davis, Rodney [R-IL-13] (Introduced 07/09/2020) Cosponsors: (1)
Capitol Police Advancement Act of 2020
2020-07-09 - Introduced in House
Committees: House - House Administration
Introduced House

COMMS Act
Sponsor: Rep. Davis, Susan A. [D-CA-53] (Introduced 07/09/2020) Cosponsors: (8)
COMMS Act
2020-07-30 - Passed/agreed to in House: On passage Passed without objection.
Committees: House - Oversight and Reform; House Administration; Rules
Passed House

Supporting Apprenticeship Colleges Act of 2020
Sponsor: Rep. Craig, Angie [D-MN-2] (Introduced 07/09/2020) Cosponsors: (3)
Supporting Apprenticeship Colleges Act of 2020
2020-07-09 - Introduced in House
Committees: House - Education and Labor
Introduced House

AHEAD Act of 2020
Sponsor: Rep. Cox, TJ [D-CA-21] (Introduced 07/09/2020) Cosponsors: (5)
AHEAD Act of 2020
2020-07-09 - Introduced in House
Committees: House - Energy and Commerce
Introduced House

TSA Second Screening Act
Sponsor: Rep. Cohen, Steve [D-TN-9] (Introduced 07/09/2020) Cosponsors: (1)
TSA Second Screening Act
2020-07-09 - Introduced in House
Committees: House - Homeland Security
Introduced House

To provide supplemental appropriations to U.S. Citizenship and Immigration Services, and for other purposes.
Sponsor: Rep. Cleaver, Emanuel [D-MO-5] (Introduced 07/09/2020) Cosponsors: (16)
To provide supplemental appropriations to U.S. Citizenship and Immigration Services, and for other purposes.
2020-07-09 - Introduced in House
Committees: House - Appropriations; Budget
Introduced House

State Stockpile Readiness Act of 2020
Sponsor: Rep. Carter, Earl L. "Buddy" [R-GA-1] (Introduced 07/09/2020) Cosponsors: (1)
State Stockpile Readiness Act of 2020
2020-07-09 - Introduced in House
Committees: House - Energy and Commerce
Introduced House

Justice for Victims of Lawless Cities Act of 2020
Sponsor: Rep. Budd, Ted [R-NC-13] (Introduced 07/09/2020) Cosponsors: (1)
Justice for Victims of Lawless Cities Act of 2020
2020-07-09 - Introduced in House
Committees: House - Financial Services; Judiciary; Transportation and Infrastructure
Introduced House

American Innovation Act of 2020
Sponsor: Rep. Buchanan, Vern [R-FL-16] (Introduced 07/09/2020) Cosponsors: (0)
American Innovation Act of 2020
2020-07-09 - Introduced in House
Committees: House - Budget; Ways and Means
Introduced House

VA Clinical TEAM Culture Act of 2020
Sponsor: Rep. Blunt Rochester, Lisa [D-DE-At Large] (Introduced 07/09/2020) Cosponsors: (12)
VA Clinical TEAM Culture Act of 2020
2020-07-09 - Introduced in House
Committees: House - Veterans' Affairs
Introduced House

No RIOT Act of 2020
Sponsor: Rep. Bishop, Dan [R-NC-9] (Introduced 07/09/2020) Cosponsors: (6)
No RIOT Act of 2020
2020-07-09 - Introduced in House
Committees: House - Judiciary
Introduced House

To designate the facility of the United States Postal Service located at 101 South 16th Street in Clarinda, Iowa, as the "Jessie Field Shambaugh Post Office Building".
Sponsor: Rep. Axne, Cynthia [D-IA-3] (Introduced 07/09/2020) Cosponsors: (8)
To designate the facility of the United States Postal Service located at 101 South 16th Street in Clarinda, Iowa, as the "Jessie Field Shambaugh Post Office Building".
2020-07-09 - Introduced in House
Committees: House - Oversight and Reform
Introduced House

To amend the Agricultural Marketing Act of 1946 to foster efficient markets and increase competition and transparency among packers that purchase livestock from producers.
Sponsor: Rep. Axne, Cynthia [D-IA-3] (Introduced 07/09/2020) Cosponsors: (2)
To amend the Agricultural Marketing Act of 1946 to foster efficient markets and increase competition and transparency among packers that purchase livestock from producers.
2020-07-09 - Introduced in House
Committees: House - Agriculture
Introduced House

Limit on the Expansion of the Authorization for Use of Military Force Act
Sponsor: Rep. Brown, Anthony G. [D-MD-4] (Introduced 07/09/2020) Cosponsors: (11)
Limit on the Expansion of the Authorization for Use of Military Force Act
2020-07-09 - Introduced in House
Committees: House - Foreign Affairs
Introduced House

Social Security COVID Correction and Equity Act
Sponsor: Rep. Larson, John B. [D-CT-1] (Introduced 07/09/2020) Cosponsors: (63)
Social Security COVID Correction and Equity Act
2020-07-09 - Introduced in House
Committees: House - Energy and Commerce; Ways and Means
Introduced House

Uplifting Our Local Communities Act
Sponsor: Rep. Tlaib, Rashida [D-MI-13] (Introduced 07/06/2020) Cosponsors: (0)
Uplifting Our Local Communities Act
2020-07-06 - Introduced in House
Committees: House - Financial Services
Introduced House

Success for Rural Students and Communities Act of 2020
Sponsor: Rep. Stefanik, Elise M. [R-NY-21] (Introduced 07/06/2020) Cosponsors: (9)
Success for Rural Students and Communities Act of 2020
2020-07-06 - Introduced in House
Committees: House - Education and Labor
Introduced House

COVID PREPARE Act of 2020
Sponsor: Rep. Schneider, Bradley Scott [D-IL-10] (Introduced 07/06/2020) Cosponsors: (31)
COVID PREPARE Act of 2020
2020-09-30 - Passed/agreed to in House: On motion to suspend the rules and pass the bill, as amended Agreed to by voice vote.
Committees: House - Oversight and Reform | Senate - Homeland Security and Governmental Affairs
Passed House

WORK NOW Act
Sponsor: Rep. Sanchez, Linda T. [D-CA-38] (Introduced 07/06/2020) Cosponsors: (10)
WORK NOW Act
2020-07-06 - Introduced in House
Committees: House - Financial Services
Introduced House

Broadband Adoption and Opportunity Act
Sponsor: Rep. O'Halleran, Tom [D-AZ-1] (Introduced 07/06/2020) Cosponsors: (1)
Broadband Adoption and Opportunity Act
2020-07-06 - Introduced in House
Committees: House - Energy and Commerce
Introduced House

Granny Pods Study Act of 2020
Sponsor: Rep. Griffith, H. Morgan [R-VA-9] (Introduced 07/06/2020) Cosponsors: (0)
Granny Pods Study Act of 2020
2020-07-06 - Introduced in House
Committees: House - Energy and Commerce; Ways and Means
Introduced House

To designate all of Puerto Rico as an opportunity zone.
Sponsor: Rep. Gonzalez-Colon, Jenniffer [R-PR-At Large] (Introduced 07/06/2020) Cosponsors: (0)
To designate all of Puerto Rico as an opportunity zone.
2020-07-06 - Introduced in House
Committees: House - Ways and Means
Introduced House

Energy Tax Credit Direct Payment Act of 2020
Sponsor: Rep. Casten, Sean [D-IL-6] (Introduced 07/06/2020) Cosponsors: (5)
Energy Tax Credit Direct Payment Act of 2020
2020-07-06 - Introduced in House
Committees: House - Energy and Commerce; Ways and Means
Introduced House

RAMP-UP Act
Sponsor: Rep. Peterson, Collin C. [D-MN-7] (Introduced 07/06/2020) Cosponsors: (20)
RAMP-UP Act
2020-07-06 - Introduced in House
Committees: House - Agriculture
Introduced House

Long Bridge Act of 2020
Sponsor: Rep. Wittman, Robert J. [R-VA-1] (Introduced 07/02/2020) Cosponsors: (12)
Long Bridge Act of 2020
2020-07-02 - Introduced in House
Committees: House - Natural Resources
Introduced House

Enhancing Oversight to End Discrimination in Policing Act
Sponsor: Rep. Richmond, Cedric L. [D-LA-2] (Introduced 07/02/2020) Cosponsors: (2)
Enhancing Oversight to End Discrimination in Policing Act
2020-07-02 - Introduced in House
Committees: House - Judiciary
Introduced House

PLACE Act
Sponsor: Rep. Pingree, Chellie [D-ME-1] (Introduced 07/02/2020) Cosponsors: (0)
PLACE Act
2020-07-02 - Introduced in House
Committees: House - Agriculture; Financial Services; Education and Labor; Judiciary; Transportation and Infrastructure; Small Business; Veterans' Affairs; Ways and Means
Introduced House

Library Stabilization Fund Act of 2020
Sponsor: Rep. Levin, Andy [D-MI-9] (Introduced 07/02/2020) Cosponsors: (64)
Library Stabilization Fund Act of 2020
2020-07-02 - Introduced in House
Committees: House - Budget; Education and Labor
Introduced House

SAFE Workers Act
Sponsor: Rep. Levin, Andy [D-MI-9] (Introduced 07/02/2020) Cosponsors: (70)
SAFE Workers Act
2020-07-02 - Introduced in House
Committees: House - Education and Labor
Introduced House

Preventing China from Exploiting COVID-19 Act
Sponsor: Rep. Horn, Kendra S. [D-OK-5] (Introduced 07/02/2020) Cosponsors: (14)
Preventing China from Exploiting COVID-19 Act
2020-07-02 - Introduced in House
Committees: House - Intelligence (Permanent Select)
Introduced House

Flexible Financing for Rural America Act of 2020
Sponsor: Rep. Hartzler, Vicky [R-MO-4] (Introduced 07/02/2020) Cosponsors: (119)
Flexible Financing for Rural America Act of 2020
2020-07-02 - Introduced in House
Committees: House - Agriculture; Budget; Energy and Commerce
Introduced House

Future of Agricultural Resiliency And Modernization Act
Sponsor: Rep. Harder, Josh [D-CA-10] (Introduced 07/02/2020) Cosponsors: (4)
Future of Agricultural Resiliency And Modernization Act
2020-07-02 - Introduced in House
Committees: House - Agriculture
Introduced House

RESTART Act
Sponsor: Rep. Golden, Jared F. [D-ME-2] (Introduced 07/02/2020) Cosponsors: (176)
RESTART Act
2020-07-02 - Introduced in House
Committees: House - Small Business; Ways and Means
Introduced House

COVID-19 Veterans Memorial Extension Act
Sponsor: Rep. Burchett, Tim [R-TN-2] (Introduced 07/02/2020) Cosponsors: (2)
COVID-19 Veterans Memorial Extension Act
2020-07-02 - Introduced in House
Committees: House - Natural Resources
Introduced House

To provide for a regional center for security studies for the Arctic in the Department of Defense, and for other purposes.
Sponsor: Rep. Young, Don [R-AK-At Large] (Introduced 07/01/2020) Cosponsors: (2)
To provide for a regional center for security studies for the Arctic in the Department of Defense, and for other purposes.
2020-07-01 - Introduced in House
Committees: House - Armed Services
Introduced House

COST of Relocations Act
Sponsor: Rep. Wexton, Jennifer [D-VA-10] (Introduced 07/01/2020) Cosponsors: (17)
COST of Relocations Act
2020-07-01 - Introduced in House
Committees: House - Oversight and Reform
Introduced House

WPA Act
Sponsor: Rep. Watson Coleman, Bonnie [D-NJ-12] (Introduced 07/01/2020) Cosponsors: (5)
WPA Act
2020-07-01 - Introduced in House
Committees: House - Education and Labor; Ways and Means
Introduced House

To direct the Secretary of Veterans Affairs to submit a report to Congress on programs to notify veterans of potential exposure to certain herbicide agents outside of Vietnam, and for other purposes.
Sponsor: Rep. Vela, Filemon [D-TX-34] (Introduced 07/01/2020) Cosponsors: (0)
To direct the Secretary of Veterans Affairs to submit a report to Congress on programs to notify veterans of potential exposure to certain herbicide agents outside of Vietnam, and for other purposes.
2020-07-01 - Introduced in House
Committees: House - Veterans' Affairs
Introduced House

Ensuring FEHBP Coverage During Pandemic Act
Sponsor: Rep. Vela, Filemon [D-TX-34] (Introduced 07/01/2020) Cosponsors: (0)
Ensuring FEHBP Coverage During Pandemic Act
2020-07-01 - Introduced in House
Committees: House - Oversight and Reform
Introduced House

Comprehensive Review of Military Suicide Act
Sponsor: Rep. Trahan, Lori [D-MA-3] (Introduced 07/01/2020) Cosponsors: (15)
Comprehensive Review of Military Suicide Act
2020-07-01 - Introduced in House
Committees: House - Armed Services
Introduced House

Main Street Revival Act of 2020
Sponsor: Rep. Swalwell, Eric [D-CA-15] (Introduced 07/01/2020) Cosponsors: (2)
Main Street Revival Act of 2020
2020-07-01 - Introduced in House
Committees: House - Ways and Means
Introduced House

Secure Data and Privacy for Contact Tracing Act of 2020
Sponsor: Rep. Speier, Jackie [D-CA-14] (Introduced 07/01/2020) Cosponsors: (10)
Secure Data and Privacy for Contact Tracing Act of 2020
2020-07-01 - Introduced in House
Committees: House - Energy and Commerce
Introduced House

SAFE While Traveling Act
Sponsor: Rep. Rush, Bobby L. [D-IL-1] (Introduced 07/01/2020) Cosponsors: (0)
SAFE While Traveling Act
2020-07-01 - Introduced in House
Committees: House - Homeland Security; Transportation and Infrastructure
Introduced House

Building a Health Care Workforce for the Future Act
Sponsor: Rep. Ruiz, Raul [D-CA-36] (Introduced 07/01/2020) Cosponsors: (0)
Building a Health Care Workforce for the Future Act
2020-07-01 - Introduced in House
Committees: House - Energy and Commerce; Ways and Means
Introduced House

Modernizing Veterans' Healthcare Eligibility Act
Sponsor: Rep. Roe, David P. [R-TN-1] (Introduced 07/01/2020) Cosponsors: (0)
Modernizing Veterans' Healthcare Eligibility Act
2020-07-01 - Introduced in House
Committees: House - Veterans' Affairs
Introduced House

Stop Home Manufacture of Ghost Guns Act of 2020
Sponsor: Rep. Raskin, Jamie [D-MD-8] (Introduced 07/01/2020) Cosponsors: (11)
Stop Home Manufacture of Ghost Guns Act of 2020
2020-07-01 - Introduced in House
Committees: House - Judiciary
Introduced House

Revolving Loan Fund Flexibility Act of 2020
Sponsor: Rep. Panetta, Jimmy [D-CA-20] (Introduced 07/01/2020) Cosponsors: (0)
Revolving Loan Fund Flexibility Act of 2020
2020-07-01 - Introduced in House
Committees: House - Financial Services; Transportation and Infrastructure
Introduced House

Emancipation Statue Removal Act
Sponsor: Rep. Norton, Eleanor Holmes [D-DC-At Large] (Introduced 07/01/2020) Cosponsors: (3)
Emancipation Statue Removal Act
2020-07-01 - Introduced in House
Committees: House - Natural Resources
Introduced House

Andrew Jackson Statue Removal Act
Sponsor: Rep. Norton, Eleanor Holmes [D-DC-At Large] (Introduced 07/01/2020) Cosponsors: (1)
Andrew Jackson Statue Removal Act
2020-07-01 - Introduced in House
Committees: House - Natural Resources
Introduced House

Elijah E. Cummings Merchant Mariner Workforce Development Act
Sponsor: Rep. Maloney, Sean Patrick [D-NY-18] (Introduced 07/01/2020) Cosponsors: (3)
Elijah E. Cummings Merchant Mariner Workforce Development Act
2020-07-01 - Introduced in House
Committees: House - Transportation and Infrastructure
Introduced House

Assisted Living Facility Coronavirus Reporting Act
Sponsor: Rep. Maloney, Carolyn B. [D-NY-12] (Introduced 07/01/2020) Cosponsors: (60)
Assisted Living Facility Coronavirus Reporting Act
2020-07-01 - Introduced in House
Committees: House - Energy and Commerce; Ways and Means
Introduced House

Pedestrian and Bicyclist Safety Improvement Act of 2020
Sponsor: Rep. Lynch, Stephen F. [D-MA-8] (Introduced 07/01/2020) Cosponsors: (0)
Pedestrian and Bicyclist Safety Improvement Act of 2020
2020-07-01 - Introduced in House
Committees: House - Transportation and Infrastructure
Introduced House

To authorize appropriations for the Department of Veterans Affairs for construction and maintenance, and for other purposes.
Sponsor: Rep. Levin, Mike [D-CA-49] (Introduced 07/01/2020) Cosponsors: (0)
To authorize appropriations for the Department of Veterans Affairs for construction and maintenance, and for other purposes.
2020-07-01 - Introduced in House
Committees: House - Veterans' Affairs
Introduced House

Peace Corps Commemorative Work Extension Act
Sponsor: Rep. Kennedy, Joseph P., III [D-MA-4] (Introduced 07/01/2020) Cosponsors: (1)
Peace Corps Commemorative Work Extension Act
2020-07-01 - Introduced in House
Committees: House - Natural Resources
Introduced House

Coronavirus Service Corps Act
Sponsor: Rep. Harder, Josh [D-CA-10] (Introduced 07/01/2020) Cosponsors: (7)
Coronavirus Service Corps Act
2020-07-01 - Introduced in House
Committees: House - Education and Labor
Introduced House

U.S. Pork Producer Assistance Act of 2020
Sponsor: Rep. Hagedorn, Jim [R-MN-1] (Introduced 07/01/2020) Cosponsors: (0)
U.S. Pork Producer Assistance Act of 2020
2020-07-01 - Introduced in House
Committees: House - Appropriations; Budget
Introduced House

Motor Carrier Safety Selection Standard Act
Sponsor: Rep. Gibbs, Bob [R-OH-7] (Introduced 07/01/2020) Cosponsors: (9)
Motor Carrier Safety Selection Standard Act
2020-07-01 - Introduced in House
Committees: House - Transportation and Infrastructure
Introduced House

To establish a grant program for domestic maritime workforce training and education, and for other purposes.
Sponsor: Rep. Garcia, Sylvia R. [D-TX-29] (Introduced 07/01/2020) Cosponsors: (10)
To establish a grant program for domestic maritime workforce training and education, and for other purposes.
2020-07-01 - Introduced in House
Committees: House - Transportation and Infrastructure
Introduced House

Equitable Payments for Nursing Facilities Act of 2020
Sponsor: Rep. Gabbard, Tulsi [D-HI-2] (Introduced 07/01/2020) Cosponsors: (2)
Equitable Payments for Nursing Facilities Act of 2020
2020-07-01 - Introduced in House
Committees: House - Education and Labor; Ways and Means
Introduced House

Treating Tribes and Counties as Good Neighbors Act
Sponsor: Rep. Fulcher, Russ [R-ID-1] (Introduced 07/01/2020) Cosponsors: (0)
Treating Tribes and Counties as Good Neighbors Act
2020-07-01 - Introduced in House
Committees: House - Agriculture; Natural Resources
Introduced House

To amend title 10, United States Code, to permit members of the Armed Forces to continue to participate in Skillbridge programs after their date of discharge or separation from active duty in the Armed Forces.
Sponsor: Rep. Fletcher, Lizzie [D-TX-7] (Introduced 07/01/2020) Cosponsors: (0)
To amend title 10, United States Code, to permit members of the Armed Forces to continue to participate in Skillbridge programs after their date of discharge or separation from active duty in the Armed Forces.
2020-07-01 - Introduced in House
Committees: House - Armed Services
Introduced House

Relief for Rural Development Borrowers Act
Sponsor: Rep. Finkenauer, Abby [D-IA-1] (Introduced 07/01/2020) Cosponsors: (2)
Relief for Rural Development Borrowers Act
2020-07-01 - Introduced in House
Committees: House - Agriculture
Introduced House

HEAL Act
Sponsor: Rep. Evans, Dwight [D-PA-3] (Introduced 07/01/2020) Cosponsors: (5)
HEAL Act
2020-07-01 - Introduced in House
Committees: House - Budget; Small Business
Introduced House

Prevent Harmful Algal Blooms Act
Sponsor: Rep. Crist, Charlie [D-FL-13] (Introduced 07/01/2020) Cosponsors: (7)
Prevent Harmful Algal Blooms Act
2020-07-01 - Introduced in House
Committees: House - Natural Resources; Science, Space, and Technology
Introduced House

Bank on Students Coronavirus Emergency Loan Refinancing Act of 2020
Sponsor: Rep. Courtney, Joe [D-CT-2] (Introduced 07/01/2020) Cosponsors: (32)
Bank on Students Coronavirus Emergency Loan Refinancing Act of 2020
2020-07-01 - Introduced in House
Committees: House - Education and Labor
Introduced House

Telework for U.S. Innovation Act
Sponsor: Rep. Connolly, Gerald E. [D-VA-11] (Introduced 07/01/2020) Cosponsors: (1)
Telework for U.S. Innovation Act
2020-07-01 - Introduced in House
Committees: House - Oversight and Reform
Introduced House

To direct the Federal Communications Commission to take certain actions to accelerate the Rural Digital Opportunity Fund Phase I auction, and for other purposes.
Sponsor: Rep. Clyburn, James E. [D-SC-6] (Introduced 07/01/2020) Cosponsors: (22)
To direct the Federal Communications Commission to take certain actions to accelerate the Rural Digital Opportunity Fund Phase I auction, and for other purposes.
2020-07-01 - Introduced in House
Committees: House - Energy and Commerce
Introduced House

Job Creation through Energy Efficient Manufacturing Act
Sponsor: Rep. Cartwright, Matt [D-PA-8] (Introduced 07/01/2020) Cosponsors: (16)
Job Creation through Energy Efficient Manufacturing Act
2020-07-01 - Introduced in House
Committees: House - Energy and Commerce; Science, Space, and Technology
Introduced House

To amend title 38, United States Code, to expand eligibility for home loans from the Secretary of Veterans Affairs to certain members of the reserve components of the Armed Forces.
Sponsor: Rep. Bost, Mike [R-IL-12] (Introduced 07/01/2020) Cosponsors: (6)
To amend title 38, United States Code, to expand eligibility for home loans from the Secretary of Veterans Affairs to certain members of the reserve components of the Armed Forces.
2020-07-01 - Introduced in House
Committees: House - Veterans' Affairs
Introduced House

Professional Military Education Review Act of 2020
Sponsor: Rep. Bacon, Don [R-NE-2] (Introduced 07/01/2020) Cosponsors: (0)
Professional Military Education Review Act of 2020
2020-07-01 - Introduced in House
Committees: House - Armed Services
Introduced House

Veterans Claim Transparency Act of 2020
Sponsor: Rep. Allred, Colin Z. [D-TX-32] (Introduced 07/01/2020) Cosponsors: (34)
Veterans Claim Transparency Act of 2020
2020-07-01 - Introduced in House
Committees: House - Veterans' Affairs
Introduced House

To extend the authorization for Augusta Canal National Heritage Area.
Sponsor: Rep. Allen, Rick W. [R-GA-12] (Introduced 07/01/2020) Cosponsors: (0)
To extend the authorization for Augusta Canal National Heritage Area.
2020-07-01 - Introduced in House
Committees: House - Natural Resources
Introduced House

Hire Veteran Health Heroes Act of 2020
Sponsor: Rep. Brooks, Susan W. [R-IN-5] (Introduced 07/01/2020) Cosponsors: (1)
Hire Veteran Health Heroes Act of 2020
2020-07-01 - Introduced in House
Committees: House - Armed Services; Veterans' Affairs
Introduced House

Hong Kong Autonomy Act
Sponsor: Rep. Sherman, Brad [D-CA-30] (Introduced 07/01/2020) Cosponsors: (11)
Hong Kong Autonomy Act
2020-07-14 - Became Public Law No: 116-149.
Committees: House - Financial Services; Foreign Affairs; Judiciary; Rules; Ways and Means
Became Law  

Retirement Savings Lost and Found Act
Sponsor: Rep. Bonamici, Suzanne [D-OR-1] (Introduced 07/01/2020) Cosponsors: (1)
Retirement Savings Lost and Found Act
2020-07-01 - Introduced in House
Committees: House - Education and Labor; Ways and Means
Introduced House

Duplication Scoring Act of 2020
Sponsor: Rep. Gosar, Paul A. [R-AZ-4] (Introduced 07/01/2020) Cosponsors: (14)
Duplication Scoring Act of 2020
2020-07-01 - Introduced in House
Committees: House - Budget; Oversight and Reform; Rules
Introduced House

To extend the authority for commitments for the paycheck protection program and separate amounts authorized for other loans under section 7(a) of the Small Business Act, and for other purposes.
Sponsor: Rep. Craig, Angie [D-MN-2] (Introduced 07/01/2020) Cosponsors: (1)
To extend the authority for commitments for the paycheck protection program and separate amounts authorized for other loans under section 7(a) of the Small Business Act, and for other purposes.
2020-07-01 - Introduced in House
Committees: House - Small Business
Introduced House

Working Families Childcare Access (WFCA) Act
Sponsor: Rep. Walorski, Jackie [R-IN-2] (Introduced 06/30/2020) Cosponsors: (1)
Working Families Childcare Access (WFCA) Act
2020-06-30 - Introduced in House
Committees: House - Ways and Means
Introduced House

Methane Emissions Reduction Act
Sponsor: Rep. Upton, Fred [R-MI-6] (Introduced 06/30/2020) Cosponsors: (0)
Methane Emissions Reduction Act
2020-06-30 - Introduced in House
Committees: House - Energy and Commerce; Science, Space, and Technology
Introduced House

To require the Administrator of the Small Business Administration to establish the interest rate for economic injury disaster loans, and for other purposes.
Sponsor: Rep. Suozzi, Thomas R. [D-NY-3] (Introduced 06/30/2020) Cosponsors: (5)
To require the Administrator of the Small Business Administration to establish the interest rate for economic injury disaster loans, and for other purposes.
2020-06-30 - Introduced in House
Committees: House - Small Business
Introduced House

Military Spouse Student Loan Deferment Act
Sponsor: Rep. Stefanik, Elise M. [R-NY-21] (Introduced 06/30/2020) Cosponsors: (7)
Military Spouse Student Loan Deferment Act
2020-06-30 - Introduced in House
Committees: House - Education and Labor
Introduced House

Don't Block LGBTQ Act of 2020
Sponsor: Rep. Schneider, Bradley Scott [D-IL-10] (Introduced 06/30/2020) Cosponsors: (12)
Don't Block LGBTQ Act of 2020
2020-06-30 - Introduced in House
Committees: House - Energy and Commerce
Introduced House

Helping Small Businesses Reopen Safely Act of 2020
Sponsor: Rep. Rouda, Harley [D-CA-48] (Introduced 06/30/2020) Cosponsors: (2)
Helping Small Businesses Reopen Safely Act of 2020
2020-06-30 - Introduced in House
Committees: House - Ways and Means
Introduced House

Screening With Dignity Act
Sponsor: Rep. Rice, Kathleen M. [D-NY-4] (Introduced 06/30/2020) Cosponsors: (6)
Screening With Dignity Act
2020-06-30 - Introduced in House
Committees: House - Homeland Security
Introduced House

Promoting Cross-border Energy Infrastructure Act
Sponsor: Rep. Mullin, Markwayne [R-OK-2] (Introduced 06/30/2020) Cosponsors: (0)
Promoting Cross-border Energy Infrastructure Act
2020-06-30 - Introduced in House
Committees: House - Energy and Commerce; Natural Resources; Transportation and Infrastructure
Introduced House

Hong Kong People's Freedom and Choice Act
Sponsor: Rep. Malinowski, Tom [D-NJ-7] (Introduced 06/30/2020) Cosponsors: (15)
Hong Kong People's Freedom and Choice Act
2020-06-30 - Introduced in House
Committees: House - Foreign Affairs; Judiciary
Introduced House

ACCESS Act
Sponsor: Rep. Lofgren, Zoe [D-CA-19] (Introduced 06/30/2020) Cosponsors: (0)
ACCESS Act
2020-06-30 - Introduced in House
Committees: House - Oversight and Reform; House Administration; Judiciary
Introduced House

Ohio River Basin Preparedness Act
Sponsor: Rep. Lamb, Conor [D-PA-17] (Introduced 06/30/2020) Cosponsors: (2)
Ohio River Basin Preparedness Act
2020-06-30 - Introduced in House
Committees: House - Agriculture; Financial Services; Energy and Commerce; Natural Resources; Transportation and Infrastructure
Introduced House

DIRECT Act
Sponsor: Rep. Johnson, Dusty [R-SD-At Large] (Introduced 06/30/2020) Cosponsors: (12)
DIRECT Act
2020-06-30 - Introduced in House
Committees: House - Agriculture
Introduced House

Selected Reserve Education Loan Repayment Program Enhancement Act
Sponsor: Rep. Haaland, Debra A. [D-NM-1] (Introduced 06/30/2020) Cosponsors: (2)
Selected Reserve Education Loan Repayment Program Enhancement Act
2020-06-30 - Introduced in House
Committees: House - Armed Services
Introduced House

Taiwan Defense Act
Sponsor: Rep. Gallagher, Mike [R-WI-8] (Introduced 06/30/2020) Cosponsors: (2)
Taiwan Defense Act
2020-06-30 - Introduced in House
Committees: House - Armed Services; Foreign Affairs
Introduced House

Money Mule Awareness Act
Sponsor: Rep. Gabbard, Tulsi [D-HI-2] (Introduced 06/30/2020) Cosponsors: (0)
Money Mule Awareness Act
2020-06-30 - Introduced in House
Committees: House - Financial Services
Introduced House

Expediting Federal Broadband Deployment Reviews Act
Sponsor: Rep. Duncan, Jeff [R-SC-3] (Introduced 06/30/2020) Cosponsors: (0)
Expediting Federal Broadband Deployment Reviews Act
2020-06-30 - Introduced in House
Committees: House - Agriculture; Energy and Commerce; Natural Resources
Introduced House

Voices for Veterans Act
Sponsor: Rep. DelBene, Suzan K. [D-WA-1] (Introduced 06/30/2020) Cosponsors: (43)
Voices for Veterans Act
2020-06-30 - Introduced in House
Committees: House - Veterans' Affairs
Introduced House

Child Poverty Reduction Act of 2020
Sponsor: Rep. Davis, Danny K. [D-IL-7] (Introduced 06/30/2020) Cosponsors: (1)
Child Poverty Reduction Act of 2020
2020-06-30 - Introduced in House
Committees: House - Oversight and Reform; Ways and Means
Introduced House

Encouraging Americans to Save Act
Sponsor: Rep. Chu, Judy [D-CA-27] (Introduced 06/30/2020) Cosponsors: (2)
Encouraging Americans to Save Act
2020-06-30 - Introduced in House
Committees: House - Ways and Means
Introduced House

National Security Resiliency and Sustainability Act of 2020
Sponsor: Rep. Casten, Sean [D-IL-6] (Introduced 06/30/2020) Cosponsors: (0)
National Security Resiliency and Sustainability Act of 2020
2020-06-30 - Introduced in House
Committees: House - Armed Services
Introduced House

Coastal and Inland Ports and Terminals Commerce Improvement Act
Sponsor: Rep. Bost, Mike [R-IL-12] (Introduced 06/30/2020) Cosponsors: (12)
Coastal and Inland Ports and Terminals Commerce Improvement Act
2020-06-30 - Introduced in House
Committees: House - Transportation and Infrastructure
Introduced House

Hong Kong Safe Harbor Act
Sponsor: Rep. Curtis, John R. [R-UT-3] (Introduced 06/30/2020) Cosponsors: (33)
Hong Kong Safe Harbor Act
2020-06-30 - Introduced in House
Committees: House - Foreign Affairs; Judiciary
Introduced House

Taiwan Fellowship Act
Sponsor: Rep. Yoho, Ted S. [R-FL-3] (Introduced 06/29/2020) Cosponsors: (24)
Taiwan Fellowship Act
2020-06-29 - Introduced in House
Committees: House - Foreign Affairs
Introduced House

Calculate PPP Forgiveness Act of 2020
Sponsor: Rep. Wagner, Ann [R-MO-2] (Introduced 06/29/2020) Cosponsors: (23)
Calculate PPP Forgiveness Act of 2020
2020-06-29 - Introduced in House
Committees: House - Small Business
Introduced House

Business Interruption Relief Act of 2020
Sponsor: Rep. Thompson, Mike [D-CA-5] (Introduced 06/29/2020) Cosponsors: (0)
Business Interruption Relief Act of 2020
2020-06-29 - Introduced in House
Committees: House - Financial Services
Introduced House

PFAS Free Military Purchasing Act
Sponsor: Rep. Slotkin, Elissa [D-MI-8] (Introduced 06/29/2020) Cosponsors: (2)
PFAS Free Military Purchasing Act
2020-06-29 - Introduced in House
Committees: House - Armed Services
Introduced House

Hydropower Clean Energy Future Act
Sponsor: Rep. McMorris Rodgers, Cathy [R-WA-5] (Introduced 06/29/2020) Cosponsors: (3)
Hydropower Clean Energy Future Act
2020-06-29 - Introduced in House
Committees: House - Oversight and Reform; Energy and Commerce
Introduced House

To temporarily extend participation in the 8(a) program of the Small Business Administration, and for other purposes.
Sponsor: Rep. Richmond, Cedric L. [D-LA-2] (Introduced 06/29/2020) Cosponsors: (0)
To temporarily extend participation in the 8(a) program of the Small Business Administration, and for other purposes.
2020-06-29 - Introduced in House
Committees: House - Small Business
Introduced House

Foreign Trade Modernization Act of 2020
Sponsor: Rep. McCaul, Michael T. [R-TX-10] (Introduced 06/29/2020) Cosponsors: (1)
Foreign Trade Modernization Act of 2020
2020-06-29 - Introduced in House
Committees: House - Financial Services; Foreign Affairs; Small Business
Introduced House

Mandatory End to Needle Distribution in Our Neighborhoods Act
Sponsor: Rep. LaMalfa, Doug [R-CA-1] (Introduced 06/29/2020) Cosponsors: (0)
Mandatory End to Needle Distribution in Our Neighborhoods Act
2020-06-29 - Introduced in House
Committees: House - Energy and Commerce
Introduced House

Nuclear Licensing Efficiency Act
Sponsor: Rep. Kinzinger, Adam [R-IL-16] (Introduced 06/29/2020) Cosponsors: (0)
Nuclear Licensing Efficiency Act
2020-06-29 - Introduced in House
Committees: House - Energy and Commerce
Introduced House

Strengthening American Nuclear Competitiveness Act
Sponsor: Rep. Johnson, Bill [R-OH-6] (Introduced 06/29/2020) Cosponsors: (0)
Strengthening American Nuclear Competitiveness Act
2020-06-29 - Introduced in House
Committees: House - Foreign Affairs; Energy and Commerce
Introduced House

Unlocking our Domestic LNG Potential Act of 2020
Sponsor: Rep. Johnson, Bill [R-OH-6] (Introduced 06/29/2020) Cosponsors: (0)
Unlocking our Domestic LNG Potential Act of 2020
2020-06-29 - Introduced in House
Committees: House - Energy and Commerce
Introduced House

Protecting Small Business Contracting Opportunities Act of 2020
Sponsor: Rep. Houlahan, Chrissy [D-PA-6] (Introduced 06/29/2020) Cosponsors: (1)
Protecting Small Business Contracting Opportunities Act of 2020
2020-06-29 - Introduced in House
Committees: House - Small Business
Introduced House

Protecting Renters from Eviction and Fees Act of 2020
Sponsor: Rep. Garcia, Jesus G. "Chuy" [D-IL-4] (Introduced 06/29/2020) Cosponsors: (29)
Protecting Renters from Eviction and Fees Act of 2020
2020-06-29 - Introduced in House
Committees: House - Financial Services; Judiciary
Introduced House

Promoting Interagency Coordination for Review of Natural Gas Pipelines Act
Sponsor: Rep. Flores, Bill [R-TX-17] (Introduced 06/29/2020) Cosponsors: (0)
Promoting Interagency Coordination for Review of Natural Gas Pipelines Act
2020-06-29 - Introduced in House
Committees: House - Energy and Commerce
Introduced House

National Biomedical Research Act
Sponsor: Rep. Clarke, Yvette D. [D-NY-9] (Introduced 12/11/2019) Cosponsors: (1)
National Biomedical Research Act
2019-12-11 - Introduced in House
Committees: House - Budget; Energy and Commerce; Rules
Introduced House

Locality Pay Equity Act of 2019
Sponsor: Rep. Cartwright, Matt [D-PA-8] (Introduced 12/11/2019) Cosponsors: (3)
Locality Pay Equity Act of 2019
2019-12-11 - Introduced in House
Committees: House - Oversight and Reform
Introduced House

Combating Online Wildlife Trafficking Act of 2019
Sponsor: Rep. Carter, Earl L. "Buddy" [R-GA-1] (Introduced 12/11/2019) Cosponsors: (1)
Combating Online Wildlife Trafficking Act of 2019
2019-12-11 - Introduced in House
Committees: House - Foreign Affairs; Natural Resources
Introduced House

Rural Education Investment Act
Sponsor: Rep. Bost, Mike [R-IL-12] (Introduced 12/11/2019) Cosponsors: (16)
Rural Education Investment Act
2019-12-11 - Introduced in House
Committees: House - Education and Labor
Introduced House

FISA Improvements Act of 2019
Sponsor: Rep. Stewart, Chris [R-UT-2] (Introduced 12/11/2019) Cosponsors: (12)
FISA Improvements Act of 2019
2019-12-11 - Introduced in House
Committees: House - Intelligence (Permanent Select); Judiciary
Introduced House

Back the Blue Act of 2019
Sponsor: Rep. Bacon, Don [R-NE-2] (Introduced 12/11/2019) Cosponsors: (4)
Back the Blue Act of 2019
2019-12-11 - Introduced in House
Committees: House - Judiciary
Introduced House

Strengthening State and Local Cybersecurity Defenses Act
Sponsor: Rep. Taylor, Van [R-TX-3] (Introduced 12/11/2019) Cosponsors: (10)
Strengthening State and Local Cybersecurity Defenses Act
2019-12-11 - Introduced in House
Committees: House - Oversight and Reform; Homeland Security
Introduced House

Affordable American-made Automobile Act
Sponsor: Rep. Speier, Jackie [D-CA-14] (Introduced 12/11/2019) Cosponsors: (31)
Affordable American-made Automobile Act
2019-12-11 - Introduced in House
Committees: House - Ways and Means
Introduced House

Social Security Enhancement and Protection Act of 2019
Sponsor: Rep. Moore, Gwen [D-WI-4] (Introduced 12/11/2019) Cosponsors: (4)
Social Security Enhancement and Protection Act of 2019
2019-12-11 - Introduced in House
Committees: House - Ways and Means
Introduced House

WHERA Act
Sponsor: Rep. Welch, Peter [D-VT-At Large] (Introduced 12/11/2019) Cosponsors: (1)
WHERA Act
2019-12-11 - Introduced in House
Committees: House - Energy and Commerce
Introduced House

Regional Ocean Partnership Act
Sponsor: Rep. Crist, Charlie [D-FL-13] (Introduced 12/11/2019) Cosponsors: (15)
Regional Ocean Partnership Act
2019-12-11 - Introduced in House
Committees: House - Natural Resources
Introduced House

Payment Integrity Information Act of 2019
Sponsor: Rep. Craig, Angie [D-MN-2] (Introduced 12/11/2019) Cosponsors: (3)
Payment Integrity Information Act of 2019
2019-12-11 - Introduced in House
Committees: House - Oversight and Reform
Introduced House

To provide that the Secretary of Education may not issue or enforce certain rules that weaken the enforcement of the prohibition of sex discrimination applicable under title IX of the Education Amendments of 1972.
Sponsor: Rep. Slotkin, Elissa [D-MI-8] (Introduced 12/10/2019) Cosponsors: (3)
To provide that the Secretary of Education may not issue or enforce certain rules that weaken the enforcement of the prohibition of sex discrimination applicable under title IX of the Education Amendments of 1972.
2019-12-10 - Introduced in House
Committees: House - Education and Labor
Introduced House

Preventing the Spread of Nuclear Weapons Act of 2019
Sponsor: Rep. Sherman, Brad [D-CA-30] (Introduced 12/10/2019) Cosponsors: (0)
Preventing the Spread of Nuclear Weapons Act of 2019
2019-12-10 - Introduced in House
Committees: House - Foreign Affairs
Introduced House

Promoting Better Patient Data Security Act of 2019
Sponsor: Rep. McNerney, Jerry [D-CA-9] (Introduced 12/10/2019) Cosponsors: (1)
Promoting Better Patient Data Security Act of 2019
2019-12-10 - Introduced in House
Committees: House - Energy and Commerce; Ways and Means
Introduced House

To amend the Omnibus Crime Control and Safe Streets Act of 1968 to authorize the Attorney General to make grants to States and units of local government to deploy and implement gunfire detection and location technology, and for other purposes.
Sponsor: Rep. Kelly, Robin L. [D-IL-2] (Introduced 12/10/2019) Cosponsors: (7)
To amend the Omnibus Crime Control and Safe Streets Act of 1968 to authorize the Attorney General to make grants to States and units of local government to deploy and implement gunfire detection and location technology, and for other purposes.
2019-12-10 - Introduced in House
Committees: House - Judiciary
Introduced House

To designate the facility of the United States Postal Service located at 100 Crosby Street in Mansfield, Louisiana, as the "Dr. C.O. Simpkins, Sr., Post Office".
Sponsor: Rep. Johnson, Mike [R-LA-4] (Introduced 12/10/2019) Cosponsors: (5)
To designate the facility of the United States Postal Service located at 100 Crosby Street in Mansfield, Louisiana, as the "Dr. C.O. Simpkins, Sr., Post Office".
2020-09-14 - Passed/agreed to in House: On motion to suspend the rules and pass the bill Agreed to by voice vote.
Committees: House - Oversight and Reform
Passed House

New Way Forward Act
Sponsor: Rep. Garcia, Jesus G. "Chuy" [D-IL-4] (Introduced 12/10/2019) Cosponsors: (44)
New Way Forward Act
2019-12-10 - Introduced in House
Committees: House - Judiciary
Introduced House

To create a mechanism whereby insulin manufacturers may sell directly to consumers at current net prices.
Sponsor: Rep. Fortenberry, Jeff [R-NE-1] (Introduced 12/10/2019) Cosponsors: (0)
To create a mechanism whereby insulin manufacturers may sell directly to consumers at current net prices.
2019-12-10 - Introduced in House
Committees: House - Energy and Commerce
Introduced House

International Pharmaceutical Transparency Act of 2019
Sponsor: Rep. DesJarlais, Scott [R-TN-4] (Introduced 12/10/2019) Cosponsors: (0)
International Pharmaceutical Transparency Act of 2019
2019-12-10 - Introduced in House
Committees: House - Energy and Commerce
Introduced House

Senior Guardianship Social Security Protection Act of 2019
Sponsor: Rep. Crist, Charlie [D-FL-13] (Introduced 12/10/2019) Cosponsors: (2)
Senior Guardianship Social Security Protection Act of 2019
2019-12-10 - Introduced in House
Committees: House - Ways and Means
Introduced House

United States Commission on International Religious Freedom Reauthorization Act of 2019
Sponsor: Rep. Cicilline, David N. [D-RI-1] (Introduced 12/10/2019) Cosponsors: (0)
United States Commission on International Religious Freedom Reauthorization Act of 2019
2019-12-10 - Introduced in House
Committees: House - Foreign Affairs; House Administration
Introduced House

Second Lieutenant Richard W. Collins III Memorial Act
Sponsor: Rep. Brown, Anthony G. [D-MD-4] (Introduced 12/10/2019) Cosponsors: (2)
Second Lieutenant Richard W. Collins III Memorial Act
2019-12-10 - Introduced in House
Committees: House - Armed Services
Introduced House

Restoring Tax Fairness for States and Localities Act
Sponsor: Rep. Suozzi, Thomas R. [D-NY-3] (Introduced 12/10/2019) Cosponsors: (52)
Restoring Tax Fairness for States and Localities Act
2019-12-19 - Passed/agreed to in House: On passage Passed by recorded vote: 218 - 206 (Roll no. 700).
Committees: House - Ways and Means | Senate - Finance
Passed House

END Child Exploitation Act
Sponsor: Rep. Gonzalez, Anthony [R-OH-16] (Introduced 12/10/2019) Cosponsors: (22)
END Child Exploitation Act
2019-12-10 - Introduced in House
Committees: House - Judiciary
Introduced House

E. Cooper Brown Ocean Clean Energy Act of 2019
Sponsor: Rep. Gabbard, Tulsi [D-HI-2] (Introduced 12/10/2019) Cosponsors: (1)
E. Cooper Brown Ocean Clean Energy Act of 2019
2019-12-10 - Introduced in House
Committees: House - Ways and Means
Introduced House

Advanced Geothermal Research and Development Act of 2019
Sponsor: Rep. Lucas, Frank D. [R-OK-3] (Introduced 12/10/2019) Cosponsors: (1)
Advanced Geothermal Research and Development Act of 2019
2020-09-11 - Reported (Amended) by the Committee on Science, Space, and Technology. H. Rept. 116-500, Part I.
Committees: House - Education and Labor; Science, Space, and Technology
Introduced House

United States Anti-Doping Agency Reauthorization Act of 2020
Sponsor: Rep. Thompson, Mike [D-CA-5] (Introduced 12/09/2019) Cosponsors: (3)
United States Anti-Doping Agency Reauthorization Act of 2020
2020-09-29 - Passed/agreed to in House: On motion to suspend the rules and pass the bill, as amended Agreed to by voice vote.
Committees: House - Energy and Commerce | Senate - Commerce, Science, and Transportation
Passed House

Safety Net Health Plan Employee Student Loan Forgiveness Fairness Act
Sponsor: Rep. Smith, Adam [D-WA-9] (Introduced 12/09/2019) Cosponsors: (3)
Safety Net Health Plan Employee Student Loan Forgiveness Fairness Act
2019-12-09 - Introduced in House
Committees: House - Education and Labor
Introduced House

Local Task Forces on 21st Century Policing Act of 2019
Sponsor: Rep. Norton, Eleanor Holmes [D-DC-At Large] (Introduced 12/09/2019) Cosponsors: (1)
Local Task Forces on 21st Century Policing Act of 2019
2019-12-09 - Introduced in House
Committees: House - Judiciary
Introduced House

To require the General Services Administration to remove a deed restriction on property located in Prescott, Arizona, and for other purposes.
Sponsor: Rep. Gosar, Paul A. [R-AZ-4] (Introduced 12/09/2019) Cosponsors: (1)
To require the General Services Administration to remove a deed restriction on property located in Prescott, Arizona, and for other purposes.
2019-12-09 - Introduced in House
Committees: House - Transportation and Infrastructure
Introduced House

Supporting Mexico Against Corruption Act
Sponsor: Rep. Gallagher, Mike [R-WI-8] (Introduced 12/09/2019) Cosponsors: (0)
Supporting Mexico Against Corruption Act
2019-12-09 - Introduced in House
Committees: House - Foreign Affairs; Judiciary
Introduced House

Faster Access to Federal Student Aid Act of 2019
Sponsor: Rep. DelBene, Suzan K. [D-WA-1] (Introduced 12/09/2019) Cosponsors: (0)
Faster Access to Federal Student Aid Act of 2019
2019-12-09 - Introduced in House
Committees: House - Education and Labor; Ways and Means
Introduced House

Stop Exploiting Children Act
Sponsor: Rep. Burchett, Tim [R-TN-2] (Introduced 12/09/2019) Cosponsors: (0)
Stop Exploiting Children Act
2019-12-09 - Introduced in House
Committees: House - Foreign Affairs
Introduced House

Chesapeake Bay Oyster Research Act
Sponsor: Rep. Brown, Anthony G. [D-MD-4] (Introduced 12/09/2019) Cosponsors: (2)
Chesapeake Bay Oyster Research Act
2019-12-09 - Introduced in House
Committees: House - Natural Resources
Introduced House

License Transfer Modernization Act of 2019
Sponsor: Rep. Flores, Bill [R-TX-17] (Introduced 12/09/2019) Cosponsors: (2)
License Transfer Modernization Act of 2019
2019-12-09 - Introduced in House
Committees: House - Energy and Commerce
Introduced House

End Price Gouging for Insulin Act
Sponsor: Rep. Beatty, Joyce [D-OH-3] (Introduced 12/09/2019) Cosponsors: (22)
End Price Gouging for Insulin Act
2019-12-09 - Introduced in House
Committees: House - Armed Services; Oversight and Reform; Energy and Commerce; Natural Resources; Veterans' Affairs; Ways and Means
Introduced House

FUTURE Act
Sponsor: Rep. Adams, Alma S. [D-NC-12] (Introduced 12/09/2019) Cosponsors: (3)
FUTURE Act
2019-12-19 - Became Public Law No: 116-91.
Committees: House - Education and Labor
Became Law 

Spittlebug Act
Sponsor: Rep. Gabbard, Tulsi [D-HI-2] (Introduced 12/09/2019) Cosponsors: (2)
Spittlebug Act
2019-12-09 - Introduced in House
Committees: House - Agriculture
Introduced House

Safe Drinking Water Assistance Act of 2019
Sponsor: Rep. Blunt Rochester, Lisa [D-DE-At Large] (Introduced 12/09/2019) Cosponsors: (1)
Safe Drinking Water Assistance Act of 2019
2019-12-09 - Introduced in House
Committees: House - Energy and Commerce; Science, Space, and Technology
Introduced House

Closing the Racial Wealth Gap Act of 2019
Sponsor: Rep. Beatty, Joyce [D-OH-3] (Introduced 12/09/2019) Cosponsors: (0)
Closing the Racial Wealth Gap Act of 2019
2019-12-09 - Introduced in House
Committees: House - Financial Services
Introduced House

DEBT Act of 2019
Sponsor: Rep. Stivers, Steve [R-OH-15] (Introduced 12/06/2019) Cosponsors: (5)
DEBT Act of 2019
2019-12-06 - Introduced in House
Committees: House - Ways and Means
Introduced House

To amend title 28, United States Code, to expand the definition of "other institutions" for purposes of acquisition, preservation, and exchange of identification records and information, and for other purposes.
Sponsor: Rep. Rose, John W. [R-TN-6] (Introduced 12/06/2019) Cosponsors: (0)
To amend title 28, United States Code, to expand the definition of "other institutions" for purposes of acquisition, preservation, and exchange of identification records and information, and for other purposes.
2019-12-06 - Introduced in House
Committees: House - Judiciary
Introduced House

Innovation Network and Capital Act of 2019
Sponsor: Rep. Peters, Scott H. [D-CA-52] (Introduced 12/06/2019) Cosponsors: (0)
Innovation Network and Capital Act of 2019
2019-12-06 - Introduced in House
Committees: House - Energy and Commerce
Introduced House

Federal Labs Modernization Act of 2019
Sponsor: Rep. Neguse, Joe [D-CO-2] (Introduced 12/06/2019) Cosponsors: (1)
Federal Labs Modernization Act of 2019
2019-12-06 - Introduced in House
Committees: House - Science, Space, and Technology
Introduced House

Stop Climate Censorship Act of 2019
Sponsor: Rep. Neguse, Joe [D-CO-2] (Introduced 12/06/2019) Cosponsors: (2)
Stop Climate Censorship Act of 2019
2019-12-06 - Introduced in House
Committees: House - Science, Space, and Technology
Introduced House

GREEN Streets Act
Sponsor: Rep. Huffman, Jared [D-CA-2] (Introduced 12/06/2019) Cosponsors: (7)
GREEN Streets Act
2019-12-06 - Introduced in House
Committees: House - Transportation and Infrastructure
Introduced House

Armed Forces Digital Advantage Act
Sponsor: Rep. Houlahan, Chrissy [D-PA-6] (Introduced 12/06/2019) Cosponsors: (1)
Armed Forces Digital Advantage Act
2019-12-06 - Introduced in House
Committees: House - Armed Services
Introduced House

Supporting America's Teachers Act of 2019
Sponsor: Rep. Horsford, Steven [D-NV-4] (Introduced 12/06/2019) Cosponsors: (0)
Supporting America's Teachers Act of 2019
2019-12-06 - Introduced in House
Committees: House - Ways and Means
Introduced House

Short Sea Shipping Act of 2019
Sponsor: Rep. Higgins, Brian [D-NY-26] (Introduced 12/06/2019) Cosponsors: (5)
Short Sea Shipping Act of 2019
2019-12-06 - Introduced in House
Committees: House - Ways and Means
Introduced House

Diversify Act
Sponsor: Rep. Garcia, Jesus G. "Chuy" [D-IL-4] (Introduced 12/06/2019) Cosponsors: (50)
Diversify Act
2019-12-06 - Introduced in House
Committees: House - Budget; Education and Labor
Introduced House

Protect SNAP Act
Sponsor: Rep. DeLauro, Rosa L. [D-CT-3] (Introduced 12/06/2019) Cosponsors: (109)
Protect SNAP Act
2019-12-06 - Introduced in House
Committees: House - Agriculture
Introduced House

Small Business Innovation Voucher Act of 2019
Sponsor: Rep. Crow, Jason [D-CO-6] (Introduced 12/06/2019) Cosponsors: (3)
Small Business Innovation Voucher Act of 2019
2019-12-06 - Introduced in House
Committees: House - Small Business
Introduced House

Disadvantaged Community Drinking 
Water Assistance Act
Sponsor: Rep. Cox, TJ [D-CA-21] (Introduced 12/06/2019) Cosponsors: (3)
Disadvantaged Community Drinking 
Water Assistance Act
2019-12-06 - Introduced in House
Committees: House - Energy and Commerce; Natural Resources
Introduced House

Jakelin Caal Death in Custody Reporting Act of 2019
Sponsor: Rep. Castro, Joaquin [D-TX-20] (Introduced 12/06/2019) Cosponsors: (6)
Jakelin Caal Death in Custody Reporting Act of 2019
2019-12-06 - Introduced in House
Committees: House - Homeland Security; Judiciary
Introduced House

Innocent Party Protection Act
Sponsor: Rep. Buck, Ken [R-CO-4] (Introduced 12/06/2019) Cosponsors: (2)
Innocent Party Protection Act
2019-12-06 - Introduced in House
Committees: House - Judiciary
Introduced House

PREVENT Act of 2019
Sponsor: Rep. Aguilar, Pete [D-CA-31] (Introduced 12/06/2019) Cosponsors: (0)
PREVENT Act of 2019
2019-12-06 - Introduced in House
Committees: House - Homeland Security
Introduced House

Hazel M. Johnson Memorial Stamp Act
Sponsor: Rep. Rush, Bobby L. [D-IL-1] (Introduced 12/06/2019) Cosponsors: (9)
Hazel M. Johnson Memorial Stamp Act
2019-12-06 - Introduced in House
Committees: House - Oversight and Reform
Introduced House

Supporting America's First Responders Act of 2019
Sponsor: Rep. Pascrell, Bill, Jr. [D-NJ-9] (Introduced 12/06/2019) Cosponsors: (4)
Supporting America's First Responders Act of 2019
2019-12-06 - Introduced in House
Committees: House - Ways and Means
Introduced House

Discouraging Frivolous Lawsuits Act
Sponsor: Rep. Rice, Tom [R-SC-7] (Introduced 12/06/2019) Cosponsors: (30)
Discouraging Frivolous Lawsuits Act
2019-12-06 - Introduced in House
Committees: House - Transportation and Infrastructure
Introduced House

Hazel M. Johnson Congressional Gold Medal Act
Sponsor: Rep. Rush, Bobby L. [D-IL-1] (Introduced 12/06/2019) Cosponsors: (8)
Hazel M. Johnson Congressional Gold Medal Act
2019-12-06 - Introduced in House
Committees: House - Financial Services; Foreign Affairs
Introduced House

Freedom To Invest in Tomorrow's Workforce Act
Sponsor: Rep. Spanberger, Abigail Davis [D-VA-7] (Introduced 12/06/2019) Cosponsors: (4)
Freedom To Invest in Tomorrow's Workforce Act
2019-12-06 - Introduced in House
Committees: House - Ways and Means
Introduced House

Global Hope Act of 2019
Sponsor: Rep. McCaul, Michael T. [R-TX-10] (Introduced 12/06/2019) Cosponsors: (20)
Global Hope Act of 2019
2020-01-28 - Passed/agreed to in House: On motion to suspend the rules and pass the bill, as amended Agreed to by voice vote.(text: CR H588-589)
Committees: House - Foreign Affairs | Senate - Foreign Relations
Passed House

Disaster Assistance Equity Act of 2019
Sponsor: Rep. Nadler, Jerrold [D-NY-10] (Introduced 12/06/2019) Cosponsors: (18)
Disaster Assistance Equity Act of 2019
2019-12-06 - Introduced in House
Committees: House - Transportation and Infrastructure
Introduced House

Investor Choice Act of 2019
Sponsor: Rep. Foster, Bill [D-IL-11] (Introduced 12/06/2019) Cosponsors: (10)
Investor Choice Act of 2019
2019-12-06 - Introduced in House
Committees: House - Financial Services
Introduced House

American Energy Opportunity Act of 2019
Sponsor: Rep. Tonko, Paul [D-NY-20] (Introduced 12/06/2019) Cosponsors: (2)
American Energy Opportunity Act of 2019
2019-12-06 - Introduced in House
Committees: House - Energy and Commerce; Ways and Means
Introduced House

Funding Our Roads and Ecosystems Sustainably Together Act
Sponsor: Rep. Carbajal, Salud O. [D-CA-24] (Introduced 12/06/2019) Cosponsors: (2)
Funding Our Roads and Ecosystems Sustainably Together Act
2019-12-06 - Introduced in House
Committees: House - Transportation and Infrastructure
Introduced House

Ensuring Patient Access to Critical Breakthrough Products Act of 2019
Sponsor: Rep. DelBene, Suzan K. [D-WA-1] (Introduced 12/06/2019) Cosponsors: (8)
Ensuring Patient Access to Critical Breakthrough Products Act of 2019
2019-12-06 - Introduced in House
Committees: House - Energy and Commerce; Ways and Means
Introduced House

Protecting Your Credit Score Act of 2020
Sponsor: Rep. Gottheimer, Josh [D-NJ-5] (Introduced 12/06/2019) Cosponsors: (1)
Protecting Your Credit Score Act of 2020
2020-06-29 - Passed/agreed to in House: On passage Passed by the Yeas and Nays: 234 - 179 (Roll no. 126).
Committees: House - Financial Services
Passed House

Fairness for All Act
Sponsor: Rep. Stewart, Chris [R-UT-2] (Introduced 12/06/2019) Cosponsors: (8)
Fairness for All Act
2019-12-06 - Introduced in House
Committees: House - Financial Services; Education and Labor; Oversight and Reform; House Administration; Judiciary; Ways and Means
Introduced House

Consumer Protection for Medical Debt Collections Act
Sponsor: Rep. Tlaib, Rashida [D-MI-13] (Introduced 12/05/2019) Cosponsors: (0)
Consumer Protection for Medical Debt Collections Act
2019-12-05 - Introduced in House
Committees: House - Financial Services
Introduced House

Freedom from Government Competition Act of 2019
Sponsor: Rep. Steube, W. Gregory [R-FL-17] (Introduced 12/05/2019) Cosponsors: (1)
Freedom from Government Competition Act of 2019
2019-12-05 - Introduced in House
Committees: House - Oversight and Reform
Introduced House

Federal Funding Accountability for Sexual Harassers Act
Sponsor: Rep. Speier, Jackie [D-CA-14] (Introduced 12/05/2019) Cosponsors: (7)
Federal Funding Accountability for Sexual Harassers Act
2019-12-05 - Introduced in House
Committees: House - Education and Labor; Oversight and Reform; Science, Space, and Technology
Introduced House

Resolving Extended Limbo for Immigrant Employees and Families Act
Sponsor: Rep. Shalala, Donna E. [D-FL-27] (Introduced 12/05/2019) Cosponsors: (3)
Resolving Extended Limbo for Immigrant Employees and Families Act
2019-12-05 - Introduced in House
Committees: House - Judiciary
Introduced House

Fairness in Nursing Home Arbitration Act
Sponsor: Rep. Sanchez, Linda T. [D-CA-38] (Introduced 12/05/2019) Cosponsors: (6)
Fairness in Nursing Home Arbitration Act
2019-12-05 - Introduced in House
Committees: House - Energy and Commerce; Ways and Means
Introduced House

Ending PUSHOUT Act of 2019
Sponsor: Rep. Pressley, Ayanna [D-MA-7] (Introduced 12/05/2019) Cosponsors: (25)
Ending PUSHOUT Act of 2019
2019-12-05 - Introduced in House
Committees: House - Education and Labor
Introduced House

Sergeant Daniel Somers Veterans Network of Support Act of 2019
Sponsor: Rep. Peters, Scott H. [D-CA-52] (Introduced 12/05/2019) Cosponsors: (5)
Sergeant Daniel Somers Veterans Network of Support Act of 2019
2019-12-05 - Introduced in House
Committees: House - Veterans' Affairs
Introduced House

Tribal Elder Care Improvement Act of 2019
Sponsor: Rep. O'Halleran, Tom [D-AZ-1] (Introduced 12/05/2019) Cosponsors: (3)
Tribal Elder Care Improvement Act of 2019
2019-12-05 - Introduced in House
Committees: House - Education and Labor
Introduced House

Ensuring Diversity in Community Banking Act
Sponsor: Rep. Meeks, Gregory W. [D-NY-5] (Introduced 12/05/2019) Cosponsors: (7)
Ensuring Diversity in Community Banking Act
2020-09-21 - Passed/agreed to in House: On motion to suspend the rules and pass the bill, as amended Agreed to by voice vote.
Committees: House - Financial Services; Small Business | Senate - Banking, Housing, and Urban Affairs
Passed House

Public Health Infrastructure Modernization Act of 2019
Sponsor: Rep. McBath, Lucy [D-GA-6] (Introduced 12/05/2019) Cosponsors: (4)
Public Health Infrastructure Modernization Act of 2019
2019-12-05 - Introduced in House
Committees: House - Energy and Commerce
